P_PARTKEY,P_NAME,P_MFGR,P_BRAND,P_TYPE,P_SIZE,P_CONTAINER,P_RETAILPRICE,P_COMMENT
1,goldenrod lavender spring chocolate lace,Manufacturer#1,Brand#13,PROMO BURNISHED COPPER,7,JUMBO PKG,901,ly. slyly ironi
2,blush thistle blue yellow saddle,Manufacturer#1,Brand#13,LARGE BRUSHED BRASS,1,LG CASE,902,lar accounts amo
3,spring green yellow purple cornsilk,Manufacturer#4,Brand#42,STANDARD POLISHED BRASS,21,WRAP CASE,903,egular deposits hag
4,cornflower chocolate smoke green pink,Manufacturer#3,Brand#34,SMALL PLATED BRASS,14,MED DRUM,904,p furiously r
5,forest brown coral puff cream,Manufacturer#3,Brand#32,STANDARD POLISHED TIN,15,SM PKG,905," wake carefully "
6,bisque cornflower lawn forest magenta,Manufacturer#2,Brand#24,PROMO PLATED STEEL,4,MED BAG,906,sual a
7,moccasin green thistle khaki floral,Manufacturer#1,Brand#11,SMALL PLATED COPPER,45,SM BAG,907,lyly. ex
8,misty lace thistle snow royal,Manufacturer#4,Brand#44,PROMO BURNISHED TIN,41,LG DRUM,908,eposi
9,thistle dim navajo dark gainsboro,Manufacturer#4,Brand#43,SMALL BURNISHED STEEL,12,WRAP CASE,909,ironic foxe
10,linen pink saddle puff powder,Manufacturer#5,Brand#54,LARGE BURNISHED STEEL,44,LG CAN,910,ithely final deposit
11,spring maroon seashell almond orchid,Manufacturer#2,Brand#25,STANDARD BURNISHED NICKEL,43,WRAP BOX,911,ng gr
12,cornflower wheat orange maroon ghost,Manufacturer#3,Brand#33,MEDIUM ANODIZED STEEL,25,JUMBO CASE,912," quickly"
13,ghost olive orange rosy thistle,Manufacturer#5,Brand#55,MEDIUM BURNISHED NICKEL,1,JUMBO PACK,913,osits.
14,khaki seashell rose cornsilk navajo,Manufacturer#1,Brand#13,SMALL POLISHED STEEL,28,JUMBO BOX,914,kages c
15,blanched honeydew sky turquoise medium,Manufacturer#1,Brand#15,LARGE ANODIZED BRASS,45,LG CASE,915,usual ac
16,deep sky turquoise drab peach,Manufacturer#3,Brand#32,PROMO PLATED TIN,2,MED PACK,916,unts a
17,indian navy coral pink deep,Manufacturer#4,Brand#43,ECONOMY BRUSHED STEEL,16,LG BOX,917," regular accounts"
18,turquoise indian lemon lavender misty,Manufacturer#1,Brand#11,SMALL BURNISHED STEEL,42,JUMBO PACK,918,s cajole slyly a
19,chocolate navy tan deep brown,Manufacturer#2,Brand#23,SMALL ANODIZED NICKEL,33,WRAP BOX,919," pending acc"
20,ivory navy honeydew sandy midnight,Manufacturer#1,Brand#12,LARGE POLISHED NICKEL,48,MED BAG,920,are across the asympt
21,lemon floral azure frosted lime,Manufacturer#3,Brand#33,SMALL BURNISHED TIN,31,MED BAG,921,ss packages. pendin
22,medium forest blue ghost black,Manufacturer#4,Brand#43,PROMO POLISHED BRASS,19,LG DRUM,922," even p"
23,coral lavender seashell rosy burlywood,Manufacturer#3,Brand#35,MEDIUM BURNISHED TIN,42,JUMBO JAR,923,"nic, fina"
24,seashell coral metallic midnight floral,Manufacturer#5,Brand#52,MEDIUM PLATED STEEL,20,MED CASE,924," final the"
25,aquamarine steel firebrick light turquoise,Manufacturer#5,Brand#55,STANDARD BRUSHED COPPER,3,JUMBO BAG,925,requests wake
26,beige frosted moccasin chocolate snow,Manufacturer#3,Brand#32,SMALL BRUSHED STEEL,32,SM CASE,926," instructions i"
27,saddle puff beige linen yellow,Manufacturer#1,Brand#14,LARGE ANODIZED TIN,20,MED PKG,927,s wake. ir
28,navajo yellow drab white misty,Manufacturer#4,Brand#44,SMALL PLATED COPPER,19,JUMBO PKG,928,"x-ray pending, iron"
29,lemon sky grey salmon orchid,Manufacturer#3,Brand#33,PROMO PLATED COPPER,7,LG DRUM,929," carefully fluffi"
30,cream misty steel spring medium,Manufacturer#4,Brand#42,PROMO ANODIZED TIN,17,LG BOX,930,carefully bus
31,slate seashell steel medium moccasin,Manufacturer#5,Brand#53,STANDARD BRUSHED TIN,10,LG BAG,931,uriously s
32,sandy wheat coral spring burnished,Manufacturer#4,Brand#42,ECONOMY PLATED BRASS,31,LG CASE,932,urts. carefully fin
33,spring bisque salmon slate pink,Manufacturer#2,Brand#22,ECONOMY PLATED NICKEL,16,LG PKG,933,ly eve
34,khaki steel rose ghost salmon,Manufacturer#1,Brand#13,LARGE BRUSHED STEEL,8,JUMBO BOX,934,riously ironic
35,green blush tomato burlywood seashell,Manufacturer#4,Brand#43,MEDIUM ANODIZED BRASS,14,JUMBO PACK,935,e carefully furi
36,chiffon tan forest moccasin dark,Manufacturer#2,Brand#25,SMALL BURNISHED COPPER,3,JUMBO CAN,936,olites o
37,royal coral orange burnished navajo,Manufacturer#4,Brand#45,LARGE POLISHED TIN,48,JUMBO BOX,937,silent 
38,seashell papaya white mint brown,Manufacturer#4,Brand#43,ECONOMY ANODIZED BRASS,11,SM JAR,938,structions inte
39,rose medium floral salmon powder,Manufacturer#5,Brand#53,SMALL POLISHED TIN,43,JUMBO JAR,939,se slowly above the fl
40,lemon midnight metallic sienna steel,Manufacturer#2,Brand#25,ECONOMY BURNISHED COPPER,27,SM CASE,940,! blithely specia
41,burlywood goldenrod pink peru sienna,Manufacturer#2,Brand#23,ECONOMY ANODIZED TIN,7,WRAP JAR,941,uriously. furiously cl
42,midnight turquoise lawn beige thistle,Manufacturer#5,Brand#52,MEDIUM BURNISHED TIN,45,LG BOX,942,the slow
43,medium lace midnight royal chartreuse,Manufacturer#4,Brand#44,PROMO POLISHED STEEL,5,WRAP CASE,943,e slyly along the ir
44,saddle cream wheat lemon burnished,Manufacturer#4,Brand#45,MEDIUM PLATED TIN,48,SM PACK,944,pinto beans. carefully
45,lawn peru ghost khaki maroon,Manufacturer#4,Brand#43,SMALL BRUSHED NICKEL,9,WRAP BAG,945,nts bo
46,honeydew turquoise aquamarine spring tan,Manufacturer#1,Brand#11,STANDARD POLISHED TIN,45,WRAP CASE,946,the blithely unusual 
47,honeydew red azure magenta brown,Manufacturer#4,Brand#45,LARGE BURNISHED BRASS,14,JUMBO PACK,947," even plate"
48,slate thistle cornsilk pale forest,Manufacturer#5,Brand#53,STANDARD BRUSHED STEEL,27,JUMBO CASE,948,ng to the depo
49,light firebrick cyan puff blue,Manufacturer#2,Brand#24,SMALL BURNISHED TIN,31,MED DRUM,949,ar pack
50,linen blanched tomato slate medium,Manufacturer#3,Brand#33,LARGE ANODIZED TIN,25,WRAP PKG,950,kages m
51,lime frosted indian dodger linen,Manufacturer#4,Brand#45,ECONOMY BURNISHED NICKEL,34,JUMBO PACK,951,n foxes
52,lemon midnight lace sky deep,Manufacturer#3,Brand#35,STANDARD BURNISHED TIN,25,WRAP CASE,952," final deposits. fu"
53,bisque rose cornsilk seashell purple,Manufacturer#2,Brand#23,ECONOMY BURNISHED NICKEL,32,MED BAG,953,mptot
54,blanched mint yellow papaya cyan,Manufacturer#2,Brand#21,LARGE BURNISHED COPPER,19,WRAP CASE,954,e blithely
55,sky cream deep tomato rosy,Manufacturer#2,Brand#23,ECONOMY BRUSHED COPPER,9,MED BAG,955,ly final pac
56,antique beige brown deep dodger,Manufacturer#1,Brand#12,MEDIUM PLATED STEEL,20,WRAP DRUM,956,ts. blithel
57,purple blue light sienna deep,Manufacturer#3,Brand#32,MEDIUM BURNISHED BRASS,49,MED PKG,957,lly abov
58,linen hot cornsilk drab bisque,Manufacturer#5,Brand#53,STANDARD POLISHED TIN,44,LG PACK,958," fluffily blithely reg"
59,misty brown medium mint salmon,Manufacturer#5,Brand#53,MEDIUM POLISHED TIN,2,LG BAG,959,regular exc
60,snow spring sandy olive tomato,Manufacturer#1,Brand#11,LARGE POLISHED COPPER,27,JUMBO CASE,960," integ"
61,light tan linen tomato peach,Manufacturer#5,Brand#54,SMALL BURNISHED NICKEL,18,WRAP DRUM,961,es. blithely en
62,tan cornsilk spring grey chocolate,Manufacturer#3,Brand#35,STANDARD BRUSHED BRASS,39,JUMBO BOX,962,ckly across the carefu
63,burnished puff coral light papaya,Manufacturer#3,Brand#32,STANDARD BURNISHED NICKEL,10,JUMBO CAN,963," quickly "
64,aquamarine coral lemon ivory gainsboro,Manufacturer#2,Brand#21,MEDIUM ANODIZED BRASS,1,JUMBO CAN,964,efully regular pi
65,slate drab medium puff gainsboro,Manufacturer#5,Brand#53,MEDIUM BRUSHED COPPER,3,MED CAN,965,posits after the quic
66,cornflower pale almond lemon linen,Manufacturer#3,Brand#35,PROMO ANODIZED NICKEL,46,SM CASE,966,haggle blithely iro
67,slate salmon rose spring seashell,Manufacturer#2,Brand#21,SMALL BRUSHED TIN,31,WRAP DRUM,967," regular, p"
68,bisque ivory mint purple almond,Manufacturer#1,Brand#11,PROMO ANODIZED STEEL,10,WRAP BOX,968,eposits shall h
69,lace burnished rosy antique metallic,Manufacturer#5,Brand#52,MEDIUM POLISHED BRASS,2,SM BOX,969,ely final depo
70,violet seashell firebrick dark navajo,Manufacturer#1,Brand#11,STANDARD BRUSHED STEEL,42,LG PACK,970,inal gifts. sl
71,violet firebrick cream peru white,Manufacturer#3,Brand#33,STANDARD PLATED BRASS,26,WRAP DRUM,971," packages alongside"
72,hot spring yellow azure dodger,Manufacturer#2,Brand#23,STANDARD ANODIZED TIN,25,JUMBO PACK,972,efully final the
73,cream moccasin royal dim chiffon,Manufacturer#2,Brand#21,SMALL BRUSHED COPPER,35,WRAP DRUM,973,ts haggl
74,frosted grey aquamarine thistle papaya,Manufacturer#5,Brand#55,ECONOMY ANODIZED BRASS,25,JUMBO CASE,974,ent foxes
75,aquamarine maroon wheat salmon metallic,Manufacturer#3,Brand#35,SMALL BURNISHED NICKEL,39,SM JAR,975,s sleep furiou
76,rosy light lime puff sandy,Manufacturer#3,Brand#34,MEDIUM BRUSHED COPPER,9,SM PKG,976,n accounts sleep qu
77,mint bisque chiffon snow firebrick,Manufacturer#5,Brand#52,STANDARD BRUSHED COPPER,13,MED PKG,977,uests.
78,blush forest slate seashell puff,Manufacturer#1,Brand#14,ECONOMY POLISHED STEEL,24,LG JAR,978,icing deposits wake
79,gainsboro pink grey tan almond,Manufacturer#4,Brand#45,PROMO ANODIZED BRASS,22,JUMBO BAG,979," foxes are slyly regu"
80,tomato chartreuse coral turquoise linen,Manufacturer#4,Brand#44,PROMO PLATED BRASS,28,MED CAN,980,unusual dependencies i
81,misty sandy cornsilk dodger blush,Manufacturer#5,Brand#53,ECONOMY BRUSHED TIN,21,MED BAG,981,ove the furiou
82,khaki tomato purple almond tan,Manufacturer#1,Brand#15,ECONOMY POLISHED TIN,12,WRAP BOX,982,ial requests haggle 
83,blush green dim lawn peru,Manufacturer#1,Brand#12,PROMO BURNISHED NICKEL,47,SM CAN,983,ly regul
84,salmon floral cream rose dark,Manufacturer#4,Brand#45,SMALL ANODIZED NICKEL,26,JUMBO PACK,984,ideas nag
85,dim deep aquamarine smoke pale,Manufacturer#5,Brand#55,PROMO ANODIZED NICKEL,16,LG BAG,985," silent"
86,green blanched firebrick dim cream,Manufacturer#4,Brand#44,STANDARD PLATED TIN,37,LG CASE,986," daring sheaves "
87,purple lace seashell antique orange,Manufacturer#4,Brand#41,LARGE PLATED STEEL,41,WRAP PACK,987,yly final
88,lime orange bisque chartreuse lemon,Manufacturer#4,Brand#44,PROMO PLATED COPPER,16,SM CASE,988,e regular packages. 
89,ghost lace lemon sienna saddle,Manufacturer#5,Brand#53,STANDARD BURNISHED STEEL,7,MED JAR,989,y final pinto 
90,hot rosy violet plum pale,Manufacturer#5,Brand#51,ECONOMY POLISHED STEEL,49,JUMBO CAN,990,caref
91,misty bisque lavender spring turquoise,Manufacturer#2,Brand#21,STANDARD BRUSHED TIN,32,JUMBO PKG,991,counts dete
92,blush magenta ghost tomato rose,Manufacturer#2,Brand#22,STANDARD ANODIZED TIN,35,JUMBO PKG,992,he ironic accounts. sp
93,pale yellow cornsilk dodger moccasin,Manufacturer#2,Brand#24,LARGE ANODIZED TIN,2,WRAP DRUM,993," platel"
94,blanched pink frosted mint snow,Manufacturer#3,Brand#35,STANDARD POLISHED BRASS,32,SM BOX,994,s accounts cajo
95,dodger beige wheat orchid navy,Manufacturer#3,Brand#33,LARGE BRUSHED TIN,36,WRAP DRUM,995," final pinto beans "
96,chocolate light firebrick rose indian,Manufacturer#5,Brand#53,STANDARD BRUSHED STEEL,32,SM CASE,996,ng to the bli
97,coral dodger beige black chartreuse,Manufacturer#3,Brand#33,MEDIUM POLISHED BRASS,49,WRAP CAN,997,ss excuses sleep am
98,frosted peru chiffon yellow aquamarine,Manufacturer#5,Brand#54,STANDARD ANODIZED BRASS,22,MED JAR,998,e the q
99,mint grey purple sienna metallic,Manufacturer#2,Brand#21,SMALL BURNISHED STEEL,11,JUMBO PKG,999,press
100,cyan orchid indian cornflower saddle,Manufacturer#3,Brand#33,ECONOMY ANODIZED TIN,4,LG BAG,1000,of the steal
101,powder deep lavender violet gainsboro,Manufacturer#3,Brand#32,LARGE ANODIZED STEEL,26,JUMBO JAR,1001,"ly even,"
102,papaya maroon blush powder sky,Manufacturer#3,Brand#31,MEDIUM BURNISHED BRASS,17,SM DRUM,1002,ular packa
103,navy sky spring orchid forest,Manufacturer#2,Brand#25,MEDIUM PLATED BRASS,45,WRAP DRUM,1003,e blithely blith
104,plum cyan cornflower midnight royal,Manufacturer#1,Brand#13,MEDIUM ANODIZED STEEL,36,JUMBO BAG,1004,ites sleep quickly
105,dodger slate pale mint navajo,Manufacturer#1,Brand#15,SMALL POLISHED COPPER,27,LG DRUM,1005,odolites was 
106,cornsilk bisque seashell lemon frosted,Manufacturer#3,Brand#31,MEDIUM PLATED BRASS,28,WRAP DRUM,1006,unts maintain 
107,violet honeydew bisque sienna orchid,Manufacturer#5,Brand#53,SMALL BURNISHED TIN,12,MED BOX,1007,slyly special depos
108,bisque peach magenta tomato yellow,Manufacturer#1,Brand#12,PROMO PLATED NICKEL,41,MED PKG,1008,after the carefully 
109,lemon black indian cornflower pale,Manufacturer#3,Brand#33,ECONOMY POLISHED TIN,11,LG PACK,1009,instruction
110,firebrick navy rose beige black,Manufacturer#3,Brand#33,STANDARD BURNISHED COPPER,46,LG DRUM,1010,t quickly a
111,orange cornflower mint snow peach,Manufacturer#5,Brand#54,LARGE BRUSHED COPPER,28,JUMBO JAR,1011,kly bold epitaphs 
112,hot aquamarine tomato lace indian,Manufacturer#4,Brand#43,PROMO BRUSHED STEEL,42,JUMBO CAN,1012,"the express, "
113,almond seashell azure blanched light,Manufacturer#3,Brand#31,PROMO POLISHED TIN,23,LG CAN,1013,finally even 
114,pink black blanched lace chartreuse,Manufacturer#5,Brand#51,MEDIUM POLISHED NICKEL,41,MED PACK,1014,ully final foxes. pint
115,spring chiffon cream orchid dodger,Manufacturer#4,Brand#45,STANDARD POLISHED STEEL,24,MED CAN,1015,counts nag! caref
116,goldenrod black slate forest red,Manufacturer#5,Brand#53,PROMO POLISHED NICKEL,33,SM PACK,1016,usly final courts 
117,tomato honeydew pale red yellow,Manufacturer#1,Brand#14,SMALL BRUSHED TIN,25,LG BAG,1017,ages acc
118,ghost plum brown coral cornsilk,Manufacturer#2,Brand#25,PROMO ANODIZED TIN,31,MED PACK,1018,ly ironic pinto
119,olive metallic slate peach green,Manufacturer#4,Brand#43,LARGE POLISHED STEEL,30,WRAP CASE,1019,out the quickly r
120,pink powder mint moccasin navajo,Manufacturer#1,Brand#14,SMALL ANODIZED NICKEL,45,WRAP JAR,1020,lly a
121,bisque royal goldenrod medium thistle,Manufacturer#1,Brand#14,ECONOMY BRUSHED COPPER,13,SM PKG,1021,deposi
122,gainsboro royal forest dark lace,Manufacturer#2,Brand#21,MEDIUM ANODIZED TIN,8,LG DRUM,1022,sts c
123,deep dim peach light beige,Manufacturer#1,Brand#12,SMALL BURNISHED TIN,31,JUMBO PKG,1023,ray regula
124,wheat blush forest metallic navajo,Manufacturer#3,Brand#32,PROMO ANODIZED STEEL,1,LG BOX,1024,g the expr
125,mint ivory saddle peach midnight,Manufacturer#1,Brand#12,STANDARD BRUSHED BRASS,17,WRAP BAG,1025,kages against
126,burnished black blue metallic orchid,Manufacturer#4,Brand#45,MEDIUM BRUSHED NICKEL,4,LG BAG,1026,es sleep al
127,royal coral orchid spring sky,Manufacturer#5,Brand#52,SMALL BURNISHED NICKEL,14,LG JAR,1027,lithely expr
128,dark burlywood burnished snow sky,Manufacturer#2,Brand#22,PROMO PLATED TIN,5,SM BAG,1028,e of the furiously ex
129,grey spring chiffon thistle lime,Manufacturer#1,Brand#15,LARGE POLISHED TIN,20,SM JAR,1029," careful"
130,gainsboro powder cyan pale rosy,Manufacturer#2,Brand#23,SMALL PLATED NICKEL,26,LG BOX,1030,ake slyly
131,tomato moccasin cyan brown goldenrod,Manufacturer#5,Brand#52,STANDARD ANODIZED BRASS,43,MED DRUM,1031,nts wake dar
132,seashell papaya tomato lime hot,Manufacturer#4,Brand#45,STANDARD BURNISHED BRASS,2,WRAP DRUM,1032,ckly expre
133,firebrick black dodger pink salmon,Manufacturer#1,Brand#13,SMALL BRUSHED NICKEL,19,LG PKG,1033," final pinto beans"
134,steel beige mint maroon indian,Manufacturer#4,Brand#42,SMALL POLISHED STEEL,35,SM PKG,1034,es. bold pa
135,thistle chocolate ghost gainsboro peru,Manufacturer#2,Brand#21,MEDIUM BURNISHED STEEL,24,JUMBO CASE,1035,l frets 
136,cornsilk maroon blanched thistle rosy,Manufacturer#2,Brand#22,SMALL PLATED STEEL,2,WRAP BAG,1036,kages print carefully
137,cornsilk drab ghost sandy royal,Manufacturer#3,Brand#31,ECONOMY PLATED STEEL,25,MED PACK,1037,the t
138,dark aquamarine tomato medium puff,Manufacturer#1,Brand#13,ECONOMY BURNISHED COPPER,42,JUMBO DRUM,1038,ts solve acro
139,floral steel burlywood navy cream,Manufacturer#3,Brand#32,MEDIUM BRUSHED STEEL,7,SM BOX,1039,ter t
140,aquamarine lavender maroon slate hot,Manufacturer#5,Brand#53,STANDARD PLATED STEEL,45,SM BOX,1040,oss the carefu
141,honeydew magenta tomato spring medium,Manufacturer#3,Brand#35,STANDARD ANODIZED STEEL,23,SM PKG,1041,ans nag furiously pen
142,chartreuse linen grey slate saddle,Manufacturer#5,Brand#55,STANDARD ANODIZED BRASS,36,MED JAR,1042,he accounts. pac
143,bisque dodger blanched steel maroon,Manufacturer#3,Brand#34,ECONOMY PLATED TIN,44,MED BAG,1043,nts across the
144,hot midnight orchid dim steel,Manufacturer#1,Brand#14,SMALL ANODIZED TIN,26,SM BOX,1044,owly 
145,navajo lavender chocolate deep hot,Manufacturer#5,Brand#53,PROMO BRUSHED COPPER,24,SM BAG,1045,es wake furiously blit
146,azure smoke mint cream burlywood,Manufacturer#3,Brand#34,STANDARD BRUSHED COPPER,11,WRAP PACK,1046,unts cajole
147,honeydew orange dodger linen lace,Manufacturer#1,Brand#11,MEDIUM PLATED COPPER,29,JUMBO PKG,1047,wake never bold 
148,yellow white ghost lavender salmon,Manufacturer#3,Brand#31,STANDARD PLATED STEEL,20,SM BOX,1048,platelets wake fu
149,tan thistle frosted indian lawn,Manufacturer#2,Brand#24,MEDIUM BURNISHED NICKEL,6,MED PKG,1049,leep requests. dog
150,pale rose navajo firebrick aquamarine,Manufacturer#3,Brand#35,LARGE BRUSHED TIN,21,SM BAG,1050,ironic foxes
151,chartreuse linen violet ghost thistle,Manufacturer#3,Brand#34,LARGE PLATED BRASS,45,MED CAN,1051,ccounts nag i
152,white sky antique tomato chartreuse,Manufacturer#5,Brand#53,MEDIUM POLISHED STEEL,48,MED CASE,1052,thely regular t
153,linen frosted slate coral peru,Manufacturer#1,Brand#11,STANDARD PLATED TIN,20,MED BAG,1053,thlessly. silen
154,peru moccasin peach pale spring,Manufacturer#1,Brand#11,ECONOMY ANODIZED TIN,1,JUMBO BAG,1054,posits 
155,puff yellow cyan tomato purple,Manufacturer#2,Brand#21,SMALL BRUSHED NICKEL,28,WRAP CASE,1055,"lly ironic, r"
156,almond ghost powder blush forest,Manufacturer#4,Brand#43,SMALL POLISHED NICKEL,2,LG PKG,1056," pinto beans. eve"
157,navajo linen coral brown forest,Manufacturer#1,Brand#11,ECONOMY ANODIZED STEEL,26,JUMBO PACK,1057,ial courts. ru
158,magenta light misty navy honeydew,Manufacturer#4,Brand#45,MEDIUM BURNISHED COPPER,47,LG JAR,1058," ideas detect slyl"
159,white orange antique beige aquamarine,Manufacturer#4,Brand#43,SMALL ANODIZED BRASS,46,SM BAG,1059," ironic requests-- pe"
160,frosted cornflower khaki salmon metallic,Manufacturer#5,Brand#55,STANDARD POLISHED COPPER,47,JUMBO CAN,1060,nts are carefully
161,metallic khaki navy forest cyan,Manufacturer#2,Brand#22,STANDARD PLATED TIN,17,SM PACK,1061,r the bl
162,burlywood cornflower aquamarine misty snow,Manufacturer#3,Brand#33,MEDIUM ANODIZED COPPER,35,JUMBO PACK,1062,e slyly around th
163,blush metallic maroon lawn forest,Manufacturer#2,Brand#21,ECONOMY PLATED TIN,34,WRAP DRUM,1063,nly s
164,orange cyan magenta navajo indian,Manufacturer#2,Brand#23,LARGE PLATED BRASS,35,JUMBO BAG,1064,mong th
165,white dim cornflower sky seashell,Manufacturer#1,Brand#15,STANDARD PLATED STEEL,24,SM CAN,1065," carefully fin"
166,linen bisque tomato gainsboro goldenrod,Manufacturer#5,Brand#52,LARGE POLISHED COPPER,4,MED BAG,1066,ss the
167,almond floral grey dim sky,Manufacturer#3,Brand#32,LARGE ANODIZED STEEL,46,WRAP BOX,1067,ic ac
168,lace gainsboro burlywood smoke tomato,Manufacturer#1,Brand#13,SMALL BRUSHED COPPER,20,JUMBO DRUM,1068,ss package
169,bisque misty sky cornflower peach,Manufacturer#5,Brand#55,STANDARD POLISHED BRASS,10,JUMBO CASE,1069,lets alongside of
170,peru grey blanched goldenrod yellow,Manufacturer#3,Brand#33,LARGE POLISHED COPPER,28,LG DRUM,1070,yly s
171,beige violet black magenta chartreuse,Manufacturer#1,Brand#11,STANDARD BURNISHED COPPER,40,LG JAR,1071," the r"
172,medium goldenrod linen sky coral,Manufacturer#5,Brand#53,PROMO PLATED NICKEL,28,MED CASE,1072,quick as
173,chartreuse seashell powder navy grey,Manufacturer#1,Brand#12,ECONOMY BURNISHED TIN,17,LG CASE,1073,sly bold excuses haggl
174,hot cornflower slate saddle pale,Manufacturer#1,Brand#15,ECONOMY BRUSHED COPPER,25,LG CASE,1074," accounts nag ab"
175,magenta blue chartreuse tan green,Manufacturer#1,Brand#11,PROMO ANODIZED TIN,45,JUMBO JAR,1075,ole against the
176,pink drab ivory papaya grey,Manufacturer#2,Brand#24,SMALL ANODIZED STEEL,40,MED CAN,1076,blithely. ironic
177,indian turquoise purple green spring,Manufacturer#2,Brand#21,MEDIUM BRUSHED STEEL,42,LG BAG,1077,ermanently eve
178,lace blanched magenta yellow almond,Manufacturer#1,Brand#13,STANDARD POLISHED TIN,10,LG JAR,1078,regular instructions.
179,deep puff brown blue burlywood,Manufacturer#4,Brand#43,ECONOMY BRUSHED STEEL,20,LG JAR,1079,ely regul
180,seashell maroon lace burnished lavender,Manufacturer#3,Brand#33,STANDARD BURNISHED NICKEL,7,WRAP BAG,1080,oss the 
181,antique plum smoke pink dodger,Manufacturer#2,Brand#24,MEDIUM PLATED STEEL,19,WRAP CAN,1081,al deposits 
182,beige cyan burlywood chiffon light,Manufacturer#3,Brand#31,MEDIUM ANODIZED COPPER,11,JUMBO CAN,1082,bits are 
183,ivory white burnished papaya cornflower,Manufacturer#5,Brand#52,PROMO POLISHED STEEL,35,LG PKG,1083,ly regular excus
184,ghost honeydew cyan lawn powder,Manufacturer#5,Brand#53,SMALL POLISHED TIN,42,LG BOX,1084,ding courts. idly iro
185,firebrick black ivory spring medium,Manufacturer#4,Brand#44,ECONOMY POLISHED TIN,4,WRAP BAG,1085,even foxe
186,grey purple chocolate turquoise plum,Manufacturer#2,Brand#23,ECONOMY BRUSHED TIN,15,JUMBO PKG,1086,ly reg
187,white red lace deep pale,Manufacturer#4,Brand#45,PROMO ANODIZED BRASS,45,MED CAN,1087,leep slyly s
188,moccasin steel rosy drab white,Manufacturer#5,Brand#54,ECONOMY ANODIZED BRASS,9,MED CAN,1088," above the silent p"
189,dodger moccasin lemon purple thistle,Manufacturer#2,Brand#22,MEDIUM BRUSHED BRASS,13,WRAP DRUM,1089,en requests. sauternes
190,chartreuse goldenrod midnight cornflower blush,Manufacturer#5,Brand#53,LARGE BURNISHED NICKEL,23,WRAP BAG,1090," furiously even d"
191,mint midnight puff forest peach,Manufacturer#3,Brand#31,MEDIUM POLISHED BRASS,36,WRAP BOX,1091," asymptote"
192,thistle puff pink cream orange,Manufacturer#3,Brand#34,STANDARD BRUSHED COPPER,17,MED BAG,1092,"uickly regular, expr"
193,turquoise lime royal metallic azure,Manufacturer#4,Brand#45,ECONOMY BURNISHED BRASS,31,SM PKG,1093,final ideas wake furi
194,brown black cream navy plum,Manufacturer#5,Brand#51,ECONOMY POLISHED STEEL,7,SM CAN,1094,y special accoun
195,bisque sienna hot goldenrod khaki,Manufacturer#4,Brand#41,STANDARD BRUSHED NICKEL,40,MED CASE,1095,oxes sleep care
196,pale peru linen hot maroon,Manufacturer#3,Brand#33,SMALL BURNISHED NICKEL,3,JUMBO JAR,1096,uickly special 
197,lawn lemon khaki rosy blue,Manufacturer#5,Brand#52,SMALL ANODIZED COPPER,18,SM JAR,1097,lithely after the eve
198,orange cornflower indian aquamarine white,Manufacturer#4,Brand#41,PROMO BRUSHED NICKEL,43,SM PACK,1098,ackages? carefully re
199,ivory slate lavender tan royal,Manufacturer#3,Brand#31,ECONOMY PLATED STEEL,23,JUMBO DRUM,1099,ickly regul
200,peach cornsilk navy rosy red,Manufacturer#5,Brand#54,MEDIUM POLISHED BRASS,22,LG PKG,1100,furiously even depo
201,dodger white chiffon moccasin green,Manufacturer#4,Brand#42,SMALL POLISHED STEEL,18,JUMBO BAG,1101," courts sl"
202,brown violet turquoise frosted navajo,Manufacturer#4,Brand#45,MEDIUM BRUSHED COPPER,49,MED DRUM,1102," use slyly c"
203,beige cornflower gainsboro chiffon wheat,Manufacturer#5,Brand#55,STANDARD ANODIZED STEEL,42,MED BAG,1103,usual instructio
204,floral powder deep linen hot,Manufacturer#5,Brand#54,LARGE BURNISHED COPPER,22,SM JAR,1104,egular pl
205,navajo bisque gainsboro forest coral,Manufacturer#5,Brand#54,ECONOMY PLATED NICKEL,2,JUMBO DRUM,1105," blithely regular"
206,chiffon coral wheat peru lavender,Manufacturer#2,Brand#25,LARGE ANODIZED NICKEL,23,JUMBO CAN,1106,ng theodolites 
207,blush chocolate light coral midnight,Manufacturer#3,Brand#35,STANDARD PLATED COPPER,48,MED CAN,1107,"lar, "
208,medium pink metallic honeydew ghost,Manufacturer#3,Brand#35,LARGE PLATED COPPER,5,MED PACK,1108,l deposits wak
209,sky plum pink lavender firebrick,Manufacturer#1,Brand#11,ECONOMY PLATED STEEL,6,MED CAN,1109," haggle a"
210,white sky mint chiffon blanched,Manufacturer#3,Brand#32,ECONOMY BURNISHED TIN,5,LG JAR,1110,ly until the flu
211,turquoise forest orchid cream blue,Manufacturer#3,Brand#32,MEDIUM ANODIZED NICKEL,43,LG PKG,1111,s cajole 
212,light sandy white bisque burlywood,Manufacturer#5,Brand#53,PROMO BRUSHED BRASS,42,JUMBO BOX,1112,uffily fin
213,pale midnight light ghost saddle,Manufacturer#3,Brand#35,SMALL POLISHED COPPER,14,WRAP CAN,1113,der slyly accor
214,cornsilk tomato firebrick tan puff,Manufacturer#4,Brand#41,PROMO PLATED BRASS,30,LG BAG,1114,"quests. regular, fi"
215,lace pink black orange cornflower,Manufacturer#5,Brand#52,ECONOMY BURNISHED NICKEL,19,SM PACK,1115," the carefully i"
216,tan azure slate white mint,Manufacturer#4,Brand#45,MEDIUM PLATED NICKEL,35,MED JAR,1116,gside of the unus
217,lemon thistle sandy royal peru,Manufacturer#5,Brand#52,PROMO PLATED COPPER,44,MED DRUM,1117,heodolites integrat
218,sandy khaki ghost cornflower metallic,Manufacturer#4,Brand#41,PROMO BURNISHED TIN,24,WRAP PACK,1118," furiously"
219,cyan aquamarine red plum frosted,Manufacturer#4,Brand#45,PROMO ANODIZED BRASS,31,MED JAR,1119,riously ironic reque
220,lemon firebrick lime white wheat,Manufacturer#1,Brand#14,PROMO BRUSHED BRASS,25,MED CASE,1120,heodolites sleep. c
221,chartreuse azure lemon saddle dark,Manufacturer#5,Brand#51,PROMO BRUSHED COPPER,7,LG DRUM,1121,ld asymptotes sleep ca
222,aquamarine puff antique drab beige,Manufacturer#3,Brand#33,LARGE ANODIZED BRASS,35,LG CASE,1122,"ross the ironic, un"
223,rose salmon yellow turquoise grey,Manufacturer#3,Brand#33,LARGE ANODIZED STEEL,29,MED BAG,1123,ons. even depos
224,drab lavender moccasin almond purple,Manufacturer#1,Brand#13,STANDARD POLISHED NICKEL,46,WRAP BOX,1124,y special depos
225,cornsilk powder bisque chartreuse spring,Manufacturer#4,Brand#45,ECONOMY BRUSHED TIN,23,MED CASE,1125,ts ca
226,blush navy indian peru lemon,Manufacturer#3,Brand#33,PROMO ANODIZED STEEL,7,SM PKG,1126,ular packages. some
227,dim yellow aquamarine lavender peach,Manufacturer#4,Brand#44,SMALL BRUSHED TIN,21,LG PACK,1127," silent r"
