P_PARTKEY,P_NAME,P_MFGR,P_BRAND,P_TYPE,P_SIZE,P_CONTAINER,P_RETAILPRICE,P_COMMENT
1353,blue lemon hot burnished salmon,Manufacturer#1,Brand#11,PROMO ANODIZED NICKEL,25,MED BOX,1254,ts affix blithely
1354,wheat seashell firebrick beige turquoise,Manufacturer#1,Brand#13,STANDARD POLISHED COPPER,22,MED PACK,1255,the furio
1355,firebrick metallic floral azure grey,Manufacturer#4,Brand#42,LARGE PLATED TIN,7,SM CAN,1256,ake across the eve
1356,tan burlywood light chartreuse powder,Manufacturer#3,Brand#34,SMALL BURNISHED COPPER,11,WRAP CASE,1257," brav"
1357,turquoise goldenrod forest chiffon lace,Manufacturer#3,Brand#34,SMALL BRUSHED BRASS,27,WRAP PKG,1258,y special plat
1358,almond moccasin salmon dim peru,Manufacturer#4,Brand#45,PROMO PLATED TIN,18,WRAP CASE,1259,y even instructions
1359,peru chocolate deep cream burlywood,Manufacturer#2,Brand#21,LARGE PLATED TIN,29,WRAP DRUM,1260,lyly regula
1360,ghost black thistle navy lawn,Manufacturer#2,Brand#21,STANDARD BURNISHED STEEL,31,JUMBO CASE,1261,e blithely caref
1361,misty aquamarine peru powder white,Manufacturer#2,Brand#24,ECONOMY PLATED COPPER,36,MED DRUM,1262,dogged theod
1362,burlywood seashell slate white cream,Manufacturer#1,Brand#14,PROMO PLATED BRASS,8,SM BOX,1263,ns. slyly ir
1363,royal lavender chocolate rose brown,Manufacturer#3,Brand#32,PROMO POLISHED COPPER,30,MED DRUM,1264,thin packages int
1364,spring tan ghost burnished saddle,Manufacturer#3,Brand#34,ECONOMY ANODIZED TIN,5,JUMBO CAN,1265,deposits. car
1365,brown ghost slate seashell lawn,Manufacturer#1,Brand#12,LARGE BURNISHED TIN,30,MED CASE,1266,ole alongside 
1366,lime aquamarine medium pink dim,Manufacturer#2,Brand#22,MEDIUM BRUSHED COPPER,45,LG JAR,1267,nder carefully final
1367,dodger light burnished papaya bisque,Manufacturer#4,Brand#45,ECONOMY PLATED COPPER,47,SM JAR,1268,fix slyly? quickly 
1368,aquamarine tan lemon salmon peach,Manufacturer#3,Brand#35,MEDIUM ANODIZED COPPER,32,SM BAG,1269,aggle acros
1369,ghost white moccasin yellow papaya,Manufacturer#5,Brand#54,ECONOMY BURNISHED COPPER,7,SM PKG,1270,ideas s
1370,light mint smoke pink saddle,Manufacturer#3,Brand#33,STANDARD PLATED NICKEL,36,WRAP PACK,1271,n deposits haggle
1371,burnished lime seashell blue cornsilk,Manufacturer#5,Brand#54,ECONOMY ANODIZED STEEL,42,SM BOX,1272,he special 
1372,steel seashell purple slate powder,Manufacturer#1,Brand#14,PROMO ANODIZED COPPER,41,WRAP JAR,1273," furiousl"
1373,blush antique goldenrod linen rosy,Manufacturer#3,Brand#33,ECONOMY ANODIZED TIN,13,SM PACK,1274," regular theodolites"
1374,violet plum metallic yellow lavender,Manufacturer#1,Brand#12,ECONOMY ANODIZED COPPER,43,JUMBO BAG,1275," are packages. "
1375,purple spring olive misty salmon,Manufacturer#5,Brand#51,SMALL POLISHED TIN,35,JUMBO BAG,1276," depo"
1376,aquamarine lime goldenrod maroon saddle,Manufacturer#3,Brand#34,MEDIUM BURNISHED COPPER,5,WRAP BAG,1277,s are furiou
1377,misty cornflower linen forest olive,Manufacturer#4,Brand#42,PROMO BRUSHED TIN,46,JUMBO JAR,1278,sts; slyly
1378,plum beige misty cream cornflower,Manufacturer#1,Brand#15,PROMO BRUSHED BRASS,8,WRAP CASE,1279,ending foxes. quickl
1379,green salmon papaya brown peru,Manufacturer#3,Brand#33,SMALL BRUSHED BRASS,33,MED PACK,1280,inst the regular ex
1380,azure beige olive dim orange,Manufacturer#1,Brand#14,MEDIUM BRUSHED STEEL,30,MED BAG,1281,the carefully ironi
1381,tan green magenta mint forest,Manufacturer#3,Brand#34,STANDARD BURNISHED COPPER,30,JUMBO DRUM,1282,gular foxe
1382,lime moccasin chiffon goldenrod orange,Manufacturer#5,Brand#51,STANDARD BURNISHED COPPER,17,LG JAR,1283,ts detect fluffi
1383,khaki papaya slate medium plum,Manufacturer#3,Brand#34,LARGE BRUSHED STEEL,5,SM CAN,1284,heodolites wake blithe
1384,deep light brown tan yellow,Manufacturer#5,Brand#52,PROMO BURNISHED TIN,27,WRAP PACK,1285,lar pinto beans-- 
1385,green thistle azure rosy dodger,Manufacturer#5,Brand#53,ECONOMY BURNISHED COPPER,5,JUMBO BAG,1286,telets doubt. silent
1386,goldenrod cornsilk blue grey blush,Manufacturer#3,Brand#34,STANDARD ANODIZED NICKEL,36,JUMBO PKG,1287,final th
1387,turquoise ghost navy tan khaki,Manufacturer#1,Brand#13,LARGE BURNISHED TIN,17,WRAP PKG,1288,s across
1388,drab smoke metallic pale dark,Manufacturer#5,Brand#51,SMALL BURNISHED BRASS,11,MED JAR,1289," accounts."
1389,brown maroon powder antique midnight,Manufacturer#1,Brand#12,MEDIUM ANODIZED BRASS,21,MED CAN,1290,wake 
1390,gainsboro papaya chocolate blush steel,Manufacturer#4,Brand#42,STANDARD BURNISHED COPPER,8,WRAP BAG,1291,fter the slyly perma
1391,orange grey thistle pale violet,Manufacturer#4,Brand#43,SMALL POLISHED COPPER,17,JUMBO PKG,1292,heodolites. 
1392,indian pale peru honeydew forest,Manufacturer#5,Brand#54,MEDIUM BRUSHED BRASS,18,MED PACK,1293," carefully even accou"
1393,navy blanched slate salmon lime,Manufacturer#3,Brand#34,PROMO BURNISHED COPPER,34,MED CAN,1294,endencies boost fu
1394,honeydew smoke salmon lavender dodger,Manufacturer#1,Brand#14,MEDIUM BRUSHED NICKEL,29,WRAP BAG,1295,usly. exp
1395,turquoise yellow maroon slate wheat,Manufacturer#1,Brand#12,STANDARD BRUSHED STEEL,40,SM DRUM,1296,lyly p
1396,ivory deep green pink cornflower,Manufacturer#2,Brand#21,ECONOMY BRUSHED TIN,48,SM CAN,1297,ake quickly. pi
1397,bisque almond lavender pale royal,Manufacturer#5,Brand#51,ECONOMY BURNISHED BRASS,10,LG CAN,1298,gular
1398,chartreuse peach olive coral sandy,Manufacturer#3,Brand#32,MEDIUM POLISHED TIN,27,WRAP DRUM,1299,ironic deposits haggl
1399,brown lavender spring chocolate firebrick,Manufacturer#5,Brand#54,ECONOMY POLISHED COPPER,48,JUMBO JAR,1300," furiously agai"
1400,rose spring indian violet lime,Manufacturer#1,Brand#14,MEDIUM PLATED NICKEL,44,JUMBO BOX,1301,t the quick
1401,dim midnight beige lace hot,Manufacturer#5,Brand#52,MEDIUM ANODIZED BRASS,17,JUMBO PKG,1302,usual
1402,goldenrod beige sky sandy metallic,Manufacturer#5,Brand#51,STANDARD PLATED TIN,13,SM JAR,1303,aggle slyly furi
1403,moccasin misty tan sienna dodger,Manufacturer#3,Brand#35,LARGE BRUSHED NICKEL,42,LG BOX,1304,heodoli
1404,chartreuse beige bisque dark wheat,Manufacturer#2,Brand#23,LARGE PLATED BRASS,34,SM DRUM,1305,l accounts hang fur
1405,white antique aquamarine dim ivory,Manufacturer#3,Brand#33,ECONOMY POLISHED BRASS,14,LG CAN,1306,ress p
1406,almond misty chiffon dodger goldenrod,Manufacturer#3,Brand#34,STANDARD BRUSHED STEEL,26,JUMBO CAN,1307," final p"
1407,cornflower peru seashell orchid beige,Manufacturer#5,Brand#55,PROMO ANODIZED NICKEL,25,LG CAN,1308,ilent fox
1408,misty moccasin forest floral cream,Manufacturer#1,Brand#12,STANDARD BURNISHED BRASS,17,JUMBO CAN,1309,e. esca
1409,floral goldenrod medium chocolate mint,Manufacturer#2,Brand#22,SMALL BURNISHED COPPER,11,SM BAG,1310,xes about 
1410,pink orchid lemon firebrick olive,Manufacturer#4,Brand#43,SMALL ANODIZED COPPER,44,LG PACK,1311,ke fu
1411,firebrick pink grey saddle peach,Manufacturer#5,Brand#55,PROMO BRUSHED NICKEL,2,JUMBO DRUM,1312,are sl
1412,royal beige lace burnished misty,Manufacturer#4,Brand#42,MEDIUM PLATED NICKEL,35,JUMBO BAG,1313," express accounts."
1413,navy cream orchid beige khaki,Manufacturer#4,Brand#45,ECONOMY POLISHED COPPER,28,WRAP BOX,1314,cajole carefully instr
1414,puff snow light beige midnight,Manufacturer#4,Brand#41,LARGE ANODIZED NICKEL,44,SM PACK,1315,nts us
1415,honeydew sandy plum dodger magenta,Manufacturer#2,Brand#22,PROMO BRUSHED STEEL,36,MED CAN,1316,accounts are abo
1416,rosy moccasin ghost chiffon white,Manufacturer#1,Brand#12,SMALL POLISHED TIN,21,WRAP JAR,1317,s. flu
1417,sky orchid tan peach dodger,Manufacturer#4,Brand#44,MEDIUM PLATED TIN,35,LG PKG,1318," the express,"
1418,blush powder ivory lemon maroon,Manufacturer#5,Brand#52,SMALL ANODIZED COPPER,31,LG DRUM,1319," furiously regula"
1419,chiffon red frosted peach spring,Manufacturer#1,Brand#15,LARGE POLISHED TIN,6,LG CAN,1320,"xpress, s"
1420,seashell steel lace lemon purple,Manufacturer#1,Brand#13,MEDIUM BURNISHED NICKEL,1,LG PACK,1321,he asymptotes. regula
1421,green dark mint lawn gainsboro,Manufacturer#1,Brand#13,ECONOMY POLISHED STEEL,39,JUMBO PACK,1322,egular ideas grow aft
1422,forest almond lime olive lavender,Manufacturer#1,Brand#14,STANDARD POLISHED BRASS,43,MED PACK,1323,rays. regular 
1423,cream green floral powder dim,Manufacturer#1,Brand#15,ECONOMY BRUSHED BRASS,36,WRAP PACK,1324,according to the r
1424,forest metallic blush white moccasin,Manufacturer#4,Brand#45,ECONOMY BURNISHED NICKEL,25,LG PACK,1325,ons. pinto beans w
1425,dark powder rose puff seashell,Manufacturer#4,Brand#42,LARGE PLATED BRASS,11,MED CAN,1326,xes. ironic requests u
1426,orange dim brown bisque dodger,Manufacturer#3,Brand#32,ECONOMY PLATED STEEL,21,WRAP BOX,1327,long the bl
1427,tomato white plum blush moccasin,Manufacturer#2,Brand#23,MEDIUM ANODIZED NICKEL,17,MED PKG,1328,carefully speci
1428,aquamarine orange saddle hot red,Manufacturer#3,Brand#34,ECONOMY POLISHED STEEL,42,MED PKG,1329,ld excu
1429,sky ghost papaya cyan tan,Manufacturer#2,Brand#23,SMALL PLATED BRASS,27,WRAP CAN,1330,sublate amo
1430,grey purple cyan chocolate khaki,Manufacturer#1,Brand#12,PROMO BURNISHED TIN,33,SM PKG,1331,oxes. quietly ir
1431,burnished blush gainsboro yellow ivory,Manufacturer#5,Brand#52,ECONOMY BURNISHED STEEL,17,SM PACK,1332,ter th
1432,cream red aquamarine chiffon sandy,Manufacturer#3,Brand#31,LARGE BURNISHED TIN,21,MED PKG,1333,st blit
1433,ghost steel beige puff coral,Manufacturer#1,Brand#15,ECONOMY ANODIZED BRASS,26,JUMBO PKG,1334,dolphins are 
1434,burnished grey honeydew green linen,Manufacturer#4,Brand#42,SMALL POLISHED TIN,30,JUMBO BOX,1335,"ronic, e"
1435,midnight blanched orange blue yellow,Manufacturer#5,Brand#52,STANDARD ANODIZED TIN,10,SM PACK,1336,express
1436,smoke floral green medium blush,Manufacturer#5,Brand#54,ECONOMY ANODIZED COPPER,10,LG BAG,1337,sily pending inst
1437,medium plum sienna bisque gainsboro,Manufacturer#4,Brand#44,PROMO BURNISHED COPPER,43,JUMBO JAR,1338,ly even pin
1438,sandy spring dark bisque violet,Manufacturer#2,Brand#25,ECONOMY BRUSHED COPPER,50,MED JAR,1339,about the 
1439,blanched deep sky ghost antique,Manufacturer#1,Brand#15,SMALL BRUSHED STEEL,21,JUMBO CAN,1340,eep permanen
1440,lawn moccasin maroon frosted olive,Manufacturer#1,Brand#14,STANDARD BRUSHED BRASS,16,WRAP CASE,1341,aggle. fluf
1441,rosy blush grey hot deep,Manufacturer#1,Brand#14,STANDARD ANODIZED TIN,42,JUMBO PACK,1342," furiously ironi"
1442,black navy rose honeydew violet,Manufacturer#1,Brand#14,SMALL POLISHED TIN,7,JUMBO PACK,1343,fter the ironic 
1443,lavender blue seashell brown ghost,Manufacturer#2,Brand#22,PROMO POLISHED NICKEL,40,WRAP JAR,1344,s are. pend
1444,magenta forest olive almond lawn,Manufacturer#3,Brand#31,PROMO BRUSHED NICKEL,34,SM CAN,1345,slyly even requests.
1445,peach cream smoke chartreuse violet,Manufacturer#5,Brand#54,MEDIUM ANODIZED COPPER,42,WRAP CAN,1346,the ruthless
1446,pink moccasin cornflower seashell drab,Manufacturer#2,Brand#21,ECONOMY BRUSHED NICKEL,39,JUMBO CASE,1347,lar pinto beans.
1447,peru blush lemon snow misty,Manufacturer#1,Brand#11,STANDARD ANODIZED COPPER,16,LG PACK,1348,n pinto beans wake a
1448,metallic blush plum forest salmon,Manufacturer#1,Brand#15,MEDIUM POLISHED TIN,7,JUMBO CAN,1349,ronic foxes 
1449,royal chartreuse cream papaya lime,Manufacturer#5,Brand#55,STANDARD PLATED NICKEL,11,SM JAR,1350,e slyl
1450,floral violet saddle dark blue,Manufacturer#5,Brand#51,SMALL BRUSHED COPPER,1,WRAP PKG,1351,mptotes are. deposits
1451,cornsilk pink cornflower goldenrod navajo,Manufacturer#5,Brand#54,SMALL BURNISHED STEEL,19,WRAP DRUM,1352,ests sleep always f
1452,chocolate azure green sandy beige,Manufacturer#3,Brand#31,MEDIUM PLATED TIN,36,JUMBO CAN,1353," haggle blithe"
1453,dark forest antique lace metallic,Manufacturer#1,Brand#13,MEDIUM PLATED BRASS,16,SM CASE,1354,slyly according t
1454,rosy chartreuse green hot rose,Manufacturer#3,Brand#32,MEDIUM PLATED NICKEL,8,LG PACK,1355,gular ac
1455,blue misty navajo moccasin pale,Manufacturer#5,Brand#53,LARGE BRUSHED STEEL,42,SM PACK,1356,ic excuses. fl
1456,frosted cream chartreuse goldenrod smoke,Manufacturer#5,Brand#55,STANDARD ANODIZED NICKEL,24,JUMBO DRUM,1357,bout 
1457,slate peru khaki chiffon lace,Manufacturer#3,Brand#32,SMALL PLATED BRASS,6,LG PKG,1358," final instru"
1458,forest steel floral orange frosted,Manufacturer#3,Brand#35,PROMO BRUSHED NICKEL,47,MED BOX,1359,denci
1459,burnished white midnight black snow,Manufacturer#3,Brand#35,ECONOMY BRUSHED NICKEL,6,JUMBO CAN,1360,about the caref
1460,firebrick violet cyan tomato wheat,Manufacturer#4,Brand#43,SMALL PLATED TIN,43,MED CAN,1361,ependencies poach
1461,brown saddle powder white peru,Manufacturer#2,Brand#25,ECONOMY POLISHED STEEL,41,WRAP BOX,1362," blith"
1462,salmon peru chocolate papaya firebrick,Manufacturer#1,Brand#15,MEDIUM BRUSHED COPPER,2,SM CASE,1363,al warhor
1463,salmon drab medium royal plum,Manufacturer#3,Brand#34,SMALL PLATED TIN,16,LG CASE,1364,ong the slyly ex
1464,slate blanched rosy seashell orchid,Manufacturer#2,Brand#22,LARGE POLISHED NICKEL,19,SM PACK,1365,ge quietly. furious
1465,bisque saddle cyan rose wheat,Manufacturer#5,Brand#55,SMALL ANODIZED STEEL,34,WRAP BOX,1366,"special, i"
1466,lemon saddle royal beige orange,Manufacturer#5,Brand#54,ECONOMY POLISHED BRASS,6,SM CASE,1367," the careful"
1467,olive navy almond indian coral,Manufacturer#1,Brand#15,LARGE PLATED NICKEL,30,MED BAG,1368,"ecial, pen"
1468,saddle tomato dark beige coral,Manufacturer#2,Brand#22,ECONOMY BRUSHED NICKEL,27,SM JAR,1369,ic foxes 
1469,violet spring aquamarine cream sky,Manufacturer#3,Brand#35,SMALL ANODIZED NICKEL,12,SM DRUM,1370," package"
1470,grey cornsilk chocolate maroon hot,Manufacturer#5,Brand#52,LARGE BRUSHED NICKEL,19,JUMBO CASE,1371," to the ruthless"
1471,papaya khaki dodger honeydew midnight,Manufacturer#5,Brand#55,STANDARD ANODIZED NICKEL,38,LG JAR,1372," final accounts. "
1472,lemon drab red lime mint,Manufacturer#2,Brand#22,LARGE ANODIZED STEEL,3,WRAP JAR,1373,ironic inst
1473,powder snow saddle ghost hot,Manufacturer#4,Brand#41,LARGE POLISHED NICKEL,26,MED BAG,1374,patterns slee
1474,spring frosted cornsilk blue cream,Manufacturer#5,Brand#52,ECONOMY POLISHED STEEL,28,SM JAR,1375," pinto beans. c"
1475,deep powder linen lime forest,Manufacturer#3,Brand#32,LARGE BRUSHED TIN,21,LG PKG,1376,ges. fluffily 
1476,chartreuse lawn lace midnight chiffon,Manufacturer#4,Brand#45,SMALL PLATED STEEL,38,LG PKG,1377,e blithely regular a
1477,dodger wheat puff magenta drab,Manufacturer#3,Brand#33,ECONOMY ANODIZED BRASS,11,LG CAN,1378,"final, "
1478,lavender chocolate moccasin snow green,Manufacturer#3,Brand#34,SMALL PLATED BRASS,50,MED JAR,1379,ooze fluff
1479,snow gainsboro royal brown misty,Manufacturer#3,Brand#35,LARGE BURNISHED BRASS,2,SM BAG,1380,"lar, unusual"
1480,firebrick coral black forest beige,Manufacturer#1,Brand#12,STANDARD POLISHED COPPER,35,JUMBO PKG,1381," wake slyly ar"
1481,rosy tomato ghost red peach,Manufacturer#3,Brand#31,STANDARD POLISHED STEEL,29,WRAP DRUM,1382," reque"
1482,medium floral chiffon cyan misty,Manufacturer#4,Brand#42,MEDIUM BRUSHED BRASS,20,JUMBO PKG,1383,usly pendin
1483,navajo burlywood firebrick brown wheat,Manufacturer#2,Brand#21,ECONOMY POLISHED STEEL,44,WRAP BAG,1384,slyly slyly regular
1484,cream puff coral ghost burlywood,Manufacturer#2,Brand#21,SMALL ANODIZED NICKEL,38,JUMBO PKG,1385,ar packages sleep
1485,light cornflower goldenrod orchid aquamarine,Manufacturer#1,Brand#12,LARGE PLATED COPPER,46,SM BAG,1386,theodolites c
1486,metallic beige seashell gainsboro blanched,Manufacturer#4,Brand#41,STANDARD POLISHED TIN,22,JUMBO JAR,1387,evenly bold p
1487,misty hot mint red bisque,Manufacturer#4,Brand#45,STANDARD POLISHED COPPER,44,JUMBO BOX,1388,ructions detect s
1488,blush orchid rose tomato purple,Manufacturer#4,Brand#42,PROMO BRUSHED STEEL,19,MED PKG,1389,use furious
1489,magenta chocolate khaki coral frosted,Manufacturer#2,Brand#21,PROMO PLATED COPPER,20,MED PKG,1390,after the asym
1490,indian lawn violet deep antique,Manufacturer#1,Brand#14,LARGE ANODIZED STEEL,35,LG BOX,1391,ly fox
1491,seashell dim gainsboro cyan light,Manufacturer#1,Brand#15,ECONOMY ANODIZED COPPER,28,LG PACK,1392,y even theodolite
1492,orange maroon violet midnight mint,Manufacturer#3,Brand#32,STANDARD POLISHED NICKEL,10,SM CASE,1393,ounts.
1493,metallic burlywood blue rose thistle,Manufacturer#3,Brand#34,ECONOMY BRUSHED STEEL,16,SM PKG,1394,ccounts 
1494,blue violet white papaya royal,Manufacturer#1,Brand#15,ECONOMY POLISHED TIN,47,WRAP JAR,1395,of the f
1495,pale burlywood peach snow azure,Manufacturer#5,Brand#55,SMALL POLISHED COPPER,43,SM CAN,1396,en foxes. 
1496,lemon blue tan ivory lavender,Manufacturer#3,Brand#34,MEDIUM ANODIZED TIN,20,JUMBO JAR,1397," wake blithely "
1497,azure lace chartreuse spring cream,Manufacturer#1,Brand#13,STANDARD PLATED STEEL,38,MED JAR,1398,. permanent re
1498,magenta peach chartreuse cyan peru,Manufacturer#1,Brand#15,MEDIUM ANODIZED TIN,47,WRAP CASE,1399," silent packages wake "
1499,smoke grey rosy papaya blush,Manufacturer#3,Brand#32,LARGE ANODIZED STEEL,14,LG PKG,1400,excuses. regul
1500,navajo wheat burnished moccasin spring,Manufacturer#5,Brand#51,SMALL ANODIZED STEEL,4,SM JAR,1402,s. fluffily b
1501,white seashell khaki almond antique,Manufacturer#1,Brand#11,PROMO ANODIZED BRASS,49,WRAP CAN,1403,urious
1502,royal chocolate yellow dim powder,Manufacturer#2,Brand#25,PROMO ANODIZED STEEL,22,JUMBO CASE,1404," quickly ex"
1503,antique orange peach puff steel,Manufacturer#2,Brand#21,STANDARD POLISHED TIN,36,SM CAN,1405,d carefully slyly pen
1504,misty frosted navy moccasin gainsboro,Manufacturer#2,Brand#25,LARGE PLATED STEEL,18,SM CAN,1406,luffi
1505,salmon papaya navy sandy sienna,Manufacturer#1,Brand#13,STANDARD PLATED BRASS,5,SM CASE,1407,ithely final d
1506,lavender azure smoke deep ivory,Manufacturer#2,Brand#25,MEDIUM PLATED COPPER,41,SM BOX,1408,usly regular instructi
1507,navajo saddle misty olive purple,Manufacturer#2,Brand#24,ECONOMY PLATED TIN,13,MED JAR,1409,sits af
1508,pale navajo blue orange red,Manufacturer#4,Brand#41,STANDARD BRUSHED NICKEL,11,LG BAG,1410,realms are 
1509,royal navy burlywood misty steel,Manufacturer#4,Brand#42,PROMO BRUSHED TIN,40,JUMBO BAG,1411,e quick
1510,navajo mint peru snow ghost,Manufacturer#1,Brand#11,STANDARD POLISHED TIN,1,LG DRUM,1412,its. quickl
1511,dim magenta cyan spring peach,Manufacturer#2,Brand#25,MEDIUM BRUSHED STEEL,8,JUMBO PACK,1413,efull
1512,cream brown grey burlywood bisque,Manufacturer#1,Brand#15,SMALL BURNISHED STEEL,22,JUMBO BAG,1414,bold theodolites hang
1513,cornflower puff lime pink misty,Manufacturer#3,Brand#34,STANDARD PLATED NICKEL,28,JUMBO CAN,1415,y according to the do
1514,saddle green ghost indian blue,Manufacturer#3,Brand#32,PROMO PLATED BRASS,18,SM JAR,1416,tructions among t
1515,lemon honeydew metallic saddle cream,Manufacturer#2,Brand#21,ECONOMY ANODIZED COPPER,25,SM CASE,1417,dolites are quic
1516,olive tan azure honeydew chartreuse,Manufacturer#2,Brand#21,PROMO BURNISHED COPPER,7,JUMBO BAG,1418,ions are quickly. 
1517,spring honeydew chiffon yellow rosy,Manufacturer#3,Brand#32,LARGE POLISHED STEEL,43,MED BAG,1419,uriously regular acco
1518,mint black metallic dark powder,Manufacturer#4,Brand#43,STANDARD ANODIZED STEEL,26,WRAP BAG,1420," cajole fluffily ir"
1519,coral magenta light floral tomato,Manufacturer#2,Brand#22,MEDIUM BRUSHED STEEL,4,SM PACK,1421,ular the
1520,drab turquoise ivory snow lemon,Manufacturer#1,Brand#12,STANDARD BRUSHED STEEL,40,JUMBO BAG,1422,ularly agai
1521,cyan burlywood thistle black deep,Manufacturer#5,Brand#51,ECONOMY ANODIZED TIN,42,JUMBO DRUM,1423," ironic foxes dete"
1522,dark thistle saddle navajo firebrick,Manufacturer#1,Brand#14,ECONOMY POLISHED COPPER,41,LG CAN,1424,s ideas. fo
1523,cream cornsilk linen pale bisque,Manufacturer#2,Brand#23,LARGE POLISHED COPPER,42,JUMBO DRUM,1425,"ual, final reque"
1524,turquoise white peru antique chiffon,Manufacturer#5,Brand#52,LARGE PLATED STEEL,9,SM BOX,1426," sleep furiousl"
1525,honeydew khaki brown lawn rose,Manufacturer#2,Brand#24,ECONOMY ANODIZED BRASS,2,LG CAN,1427,sly. iro
1526,chiffon seashell slate smoke lawn,Manufacturer#1,Brand#12,LARGE ANODIZED STEEL,32,WRAP JAR,1428,s accounts cajole f
1527,burnished cornflower pink puff burlywood,Manufacturer#5,Brand#51,ECONOMY POLISHED STEEL,15,MED BAG,1429,". unusual, pending pa"
1528,magenta chiffon indian almond green,Manufacturer#1,Brand#13,STANDARD POLISHED TIN,1,JUMBO CASE,1430,es cajole idly u
1529,sienna black dark peru dodger,Manufacturer#1,Brand#15,STANDARD ANODIZED BRASS,25,SM JAR,1431,ts snooze 
1530,green forest navajo magenta saddle,Manufacturer#5,Brand#51,SMALL ANODIZED TIN,18,SM DRUM,1432,ccounts boost slyly s
1531,rosy royal orange dodger smoke,Manufacturer#4,Brand#45,LARGE POLISHED COPPER,33,MED DRUM,1433," x-ray b"
1532,royal yellow orchid lime wheat,Manufacturer#2,Brand#24,SMALL PLATED TIN,10,SM PACK,1434,unts. c
1533,sky violet magenta steel slate,Manufacturer#1,Brand#12,MEDIUM PLATED TIN,48,MED PKG,1435,s wake carefully e
1534,puff mint dodger hot seashell,Manufacturer#2,Brand#24,MEDIUM BURNISHED TIN,48,MED PKG,1436,nts ar
1535,burlywood thistle royal blush ghost,Manufacturer#3,Brand#31,LARGE BURNISHED NICKEL,5,WRAP CASE,1437,s. blithely unusual d
1536,brown thistle magenta wheat blanched,Manufacturer#2,Brand#24,PROMO ANODIZED BRASS,50,MED BOX,1438,p blithely ironic 
1537,orange tan medium drab midnight,Manufacturer#2,Brand#21,ECONOMY POLISHED STEEL,33,LG JAR,1439,ly regula
1538,drab khaki lavender bisque plum,Manufacturer#3,Brand#35,SMALL ANODIZED STEEL,43,WRAP DRUM,1440," unusual "
1539,yellow orchid blue olive lavender,Manufacturer#5,Brand#54,SMALL POLISHED TIN,46,WRAP CASE,1441,y furiou
1540,chiffon salmon beige pink yellow,Manufacturer#5,Brand#52,STANDARD POLISHED STEEL,2,SM PKG,1442,ts nag acros
1541,medium sandy cream dim dark,Manufacturer#4,Brand#44,LARGE BURNISHED COPPER,11,WRAP DRUM,1443,fter the carefully
1542,purple green misty orange wheat,Manufacturer#3,Brand#31,ECONOMY BURNISHED COPPER,21,MED JAR,1444,gular 
1543,drab orchid misty puff lace,Manufacturer#4,Brand#45,STANDARD BURNISHED NICKEL,1,WRAP DRUM,1445," are slyly; q"
1544,lawn brown black almond mint,Manufacturer#5,Brand#51,LARGE BURNISHED STEEL,28,SM PKG,1446,sly pinto b
1545,steel lace chocolate yellow rose,Manufacturer#5,Brand#54,MEDIUM BURNISHED BRASS,41,MED CASE,1447,furiousl
1546,sky navajo metallic steel cyan,Manufacturer#4,Brand#43,ECONOMY PLATED TIN,19,JUMBO CASE,1448,express depend
1547,cyan orange beige magenta orchid,Manufacturer#2,Brand#23,STANDARD PLATED TIN,19,LG CAN,1449,he carefu
1548,misty steel ivory almond thistle,Manufacturer#5,Brand#52,STANDARD POLISHED BRASS,39,JUMBO CASE,1450," of the"
1549,cornsilk snow lace dodger azure,Manufacturer#2,Brand#22,SMALL POLISHED COPPER,38,MED CASE,1451,. carefully fi
1550,frosted chocolate spring peach lawn,Manufacturer#2,Brand#24,MEDIUM POLISHED BRASS,42,LG PKG,1452,c deposit
1551,tomato turquoise lawn plum hot,Manufacturer#2,Brand#25,MEDIUM BRUSHED COPPER,39,WRAP JAR,1453,s. blithely
1552,plum chartreuse sky pale firebrick,Manufacturer#4,Brand#41,SMALL POLISHED TIN,10,WRAP CASE,1454,onic deposits
1553,magenta wheat frosted medium dodger,Manufacturer#5,Brand#53,LARGE BRUSHED COPPER,21,JUMBO BAG,1455,heodol
1554,slate chocolate navy hot wheat,Manufacturer#4,Brand#44,MEDIUM PLATED COPPER,14,MED DRUM,1456,sly eve
1555,turquoise orchid steel navy chocolate,Manufacturer#3,Brand#35,LARGE BURNISHED STEEL,6,LG PKG,1457," final packages."
1556,lavender light cornsilk blue azure,Manufacturer#4,Brand#42,ECONOMY BURNISHED BRASS,17,SM PKG,1458," carefully after "
1557,white burnished turquoise sky orange,Manufacturer#3,Brand#35,STANDARD ANODIZED NICKEL,4,SM PACK,1459,s detect. furiously
1558,olive frosted chiffon maroon plum,Manufacturer#1,Brand#11,SMALL BURNISHED COPPER,39,LG CASE,1460,ns haggl
1559,deep hot midnight aquamarine dark,Manufacturer#1,Brand#14,STANDARD ANODIZED TIN,1,MED BOX,1461,ar acc
1560,beige coral powder papaya black,Manufacturer#5,Brand#52,SMALL ANODIZED NICKEL,36,WRAP DRUM,1462,uriously quiet
1561,white burnished turquoise cornsilk salmon,Manufacturer#3,Brand#33,SMALL PLATED COPPER,7,WRAP JAR,1463," regular ins"
1562,slate dark navy sandy khaki,Manufacturer#5,Brand#54,MEDIUM BURNISHED STEEL,3,MED CASE,1464,hely brave multipliers
1563,lemon puff beige orchid medium,Manufacturer#5,Brand#53,ECONOMY BRUSHED BRASS,5,MED CAN,1465,olites. blit
1564,cyan white honeydew blue hot,Manufacturer#2,Brand#21,ECONOMY PLATED BRASS,41,JUMBO BAG,1466," pinto beans against t"
1565,royal honeydew peru blush beige,Manufacturer#4,Brand#41,STANDARD PLATED TIN,49,MED PACK,1467,riously even foxe
1566,peach peru forest magenta ivory,Manufacturer#5,Brand#55,LARGE BURNISHED STEEL,46,JUMBO BOX,1468,maintain
1567,seashell pink midnight bisque lace,Manufacturer#3,Brand#35,STANDARD ANODIZED STEEL,35,WRAP PKG,1469,t sly
1568,misty dodger white yellow light,Manufacturer#5,Brand#51,MEDIUM POLISHED STEEL,27,MED CASE,1470,nstructions are 
1569,thistle cyan cream navy lavender,Manufacturer#1,Brand#13,PROMO BURNISHED TIN,1,LG PACK,1471,ts wake carefully. ca
1570,gainsboro sienna lawn lavender tan,Manufacturer#1,Brand#15,LARGE BURNISHED STEEL,41,LG CASE,1472,latelets breach abo
1571,grey sandy cornflower dodger sky,Manufacturer#5,Brand#52,STANDARD ANODIZED BRASS,22,MED BOX,1473,uctions. finally regul
1572,lemon midnight black papaya peru,Manufacturer#4,Brand#45,ECONOMY POLISHED COPPER,50,LG JAR,1474,riously ironic pinto
1573,royal chocolate red wheat almond,Manufacturer#5,Brand#52,ECONOMY ANODIZED COPPER,36,WRAP PACK,1475,theodolites. silent p
1574,spring medium dodger navajo sienna,Manufacturer#1,Brand#13,PROMO BRUSHED BRASS,27,MED CASE,1476,pinto 
1575,frosted black moccasin lawn goldenrod,Manufacturer#3,Brand#32,LARGE BURNISHED BRASS,47,LG PKG,1477,ts sn
1576,brown black ghost green cream,Manufacturer#2,Brand#24,LARGE BURNISHED STEEL,21,SM CASE,1478,entiments. ir
