P_PARTKEY,P_NAME,P_MFGR,P_BRAND,P_TYPE,P_SIZE,P_CONTAINER,P_RETAILPRICE,P_COMMENT
904,black olive light sandy linen,Manufacturer#1,Brand#12,STANDARD ANODIZED TIN,20,WRAP DRUM,1805,ar theodolites sleep b
905,burlywood honeydew cornsilk indian green,Manufacturer#2,Brand#25,PROMO BRUSHED BRASS,27,MED CASE,1806,es. furiously ir
906,rosy forest navajo light turquoise,Manufacturer#4,Brand#44,MEDIUM BURNISHED COPPER,45,MED DRUM,1807,unusua
907,plum lawn black chartreuse sandy,Manufacturer#5,Brand#52,ECONOMY ANODIZED STEEL,8,LG CASE,1808,es. carefu
908,pink navy lace papaya brown,Manufacturer#2,Brand#25,MEDIUM BURNISHED TIN,13,JUMBO JAR,1809,tions ca
909,cornsilk tomato chiffon bisque navy,Manufacturer#1,Brand#12,STANDARD PLATED TIN,40,WRAP PKG,1810,ht boost quic
910,coral antique peach navy violet,Manufacturer#4,Brand#42,STANDARD ANODIZED TIN,15,JUMBO JAR,1811,ly final 
911,blush coral medium ivory snow,Manufacturer#1,Brand#14,ECONOMY BURNISHED TIN,23,MED CAN,1812,foxes cajole after the
912,indian tomato rose powder turquoise,Manufacturer#5,Brand#55,STANDARD POLISHED NICKEL,17,SM BAG,1813,ar theodo
913,seashell medium burnished moccasin blue,Manufacturer#2,Brand#23,LARGE PLATED BRASS,49,SM DRUM,1814,yly even dol
914,snow rose moccasin tomato linen,Manufacturer#3,Brand#35,ECONOMY POLISHED STEEL,8,LG PKG,1815,ckly busil
915,aquamarine purple spring gainsboro salmon,Manufacturer#2,Brand#21,LARGE ANODIZED BRASS,25,WRAP BAG,1816,depos
916,chartreuse tomato rose chocolate magenta,Manufacturer#2,Brand#21,MEDIUM BURNISHED BRASS,28,MED CAN,1817,ons. bravely ironic
917,midnight khaki medium linen peru,Manufacturer#2,Brand#24,SMALL ANODIZED COPPER,3,SM CASE,1818,riously past th
918,ghost steel beige turquoise ivory,Manufacturer#5,Brand#55,ECONOMY PLATED TIN,15,LG PKG,1819,losely according to
919,sandy cream royal cyan orchid,Manufacturer#1,Brand#13,PROMO BRUSHED COPPER,49,MED BOX,1820,along 
920,sky lemon misty slate lawn,Manufacturer#4,Brand#44,MEDIUM BRUSHED STEEL,19,WRAP CAN,1821,y regu
921,khaki yellow plum cyan forest,Manufacturer#1,Brand#11,LARGE BURNISHED STEEL,35,JUMBO DRUM,1822,pecial in
922,frosted dodger cyan medium indian,Manufacturer#3,Brand#34,LARGE BURNISHED BRASS,30,SM CASE,1823,uctions. sl
923,moccasin lace rose navajo forest,Manufacturer#2,Brand#24,STANDARD PLATED TIN,26,WRAP CASE,1824,he packag
924,indian smoke orange ghost papaya,Manufacturer#1,Brand#11,ECONOMY POLISHED STEEL,41,JUMBO PKG,1825,the ac
925,tomato antique plum snow burlywood,Manufacturer#4,Brand#44,STANDARD POLISHED NICKEL,44,MED PACK,1826,aggle slyly. blithe
926,tan deep medium smoke slate,Manufacturer#4,Brand#45,STANDARD BRUSHED TIN,39,MED JAR,1827,gle quickly ironic 
927,dodger purple green peach navajo,Manufacturer#1,Brand#14,LARGE ANODIZED TIN,13,WRAP BAG,1828,otes snooz
928,violet dodger cyan orange moccasin,Manufacturer#4,Brand#43,SMALL ANODIZED TIN,43,SM BOX,1829,ully ev
929,burnished pale medium turquoise lace,Manufacturer#3,Brand#33,LARGE PLATED COPPER,40,MED DRUM,1830,hely iron
930,violet ivory orchid rose frosted,Manufacturer#2,Brand#23,SMALL BRUSHED BRASS,26,LG DRUM,1831,uickly ironic 
931,red puff chiffon sienna dark,Manufacturer#3,Brand#31,STANDARD ANODIZED NICKEL,37,LG CAN,1832,are fluffily. 
932,cornflower sky powder cyan linen,Manufacturer#2,Brand#24,SMALL ANODIZED COPPER,12,LG BOX,1833,ly regular depos
933,pink magenta frosted blanched lime,Manufacturer#3,Brand#33,STANDARD BRUSHED STEEL,25,LG CASE,1834,he blit
934,beige saddle magenta cyan dim,Manufacturer#4,Brand#45,STANDARD ANODIZED BRASS,40,MED JAR,1835,ual packages
935,royal cornflower maroon khaki cornsilk,Manufacturer#5,Brand#53,STANDARD BRUSHED STEEL,8,JUMBO DRUM,1836,arefully ironic
936,white beige firebrick dodger olive,Manufacturer#2,Brand#24,MEDIUM PLATED BRASS,6,WRAP DRUM,1837,longside of the reg
937,drab peru royal pink peach,Manufacturer#3,Brand#33,PROMO ANODIZED TIN,2,JUMBO CAN,1838,ithely
938,chartreuse peach spring cornflower tan,Manufacturer#2,Brand#22,LARGE BRUSHED NICKEL,1,JUMBO CASE,1839,ajole slyly r
939,salmon magenta orange coral aquamarine,Manufacturer#1,Brand#14,PROMO BURNISHED BRASS,41,WRAP PACK,1840,ages wake doggedly of 
940,violet coral blanched orange light,Manufacturer#1,Brand#15,PROMO POLISHED TIN,49,JUMBO JAR,1841,"ate blithely bold, si"
941,lace cornsilk pink medium slate,Manufacturer#2,Brand#25,MEDIUM PLATED NICKEL,8,LG PKG,1842,fully 
942,coral peach bisque green seashell,Manufacturer#3,Brand#35,PROMO POLISHED TIN,44,MED BAG,1843,nic pinto b
943,smoke sky chiffon green steel,Manufacturer#5,Brand#55,ECONOMY BRUSHED BRASS,46,SM PKG,1844,s wake
944,medium sandy olive wheat turquoise,Manufacturer#3,Brand#33,SMALL PLATED STEEL,1,LG CAN,1845," requests nag furiou"
945,chiffon steel peach black moccasin,Manufacturer#5,Brand#52,MEDIUM PLATED NICKEL,22,MED JAR,1846,uffily abo
946,medium drab rosy spring salmon,Manufacturer#2,Brand#25,MEDIUM PLATED TIN,30,LG BOX,1847,y along
947,black tan salmon maroon chartreuse,Manufacturer#1,Brand#13,MEDIUM BURNISHED STEEL,16,JUMBO JAR,1848,usual accounts. b
948,gainsboro chocolate bisque sandy steel,Manufacturer#2,Brand#22,MEDIUM ANODIZED BRASS,31,WRAP PKG,1849,furious
949,thistle burnished pink yellow wheat,Manufacturer#5,Brand#51,LARGE BURNISHED TIN,47,LG PKG,1850,l theodolit
950,steel purple midnight beige coral,Manufacturer#3,Brand#31,SMALL ANODIZED STEEL,26,WRAP CASE,1851,kages cajole quickly 
951,gainsboro indian aquamarine lemon blush,Manufacturer#2,Brand#21,STANDARD BURNISHED STEEL,40,JUMBO JAR,1852," final deposits nag a"
952,frosted purple sky steel papaya,Manufacturer#3,Brand#31,MEDIUM BRUSHED TIN,4,MED PACK,1853,l deposits sleep bli
953,tomato cornflower honeydew sandy grey,Manufacturer#4,Brand#41,PROMO ANODIZED TIN,2,WRAP JAR,1854,ly quickly final acco
954,turquoise bisque khaki coral antique,Manufacturer#5,Brand#55,ECONOMY ANODIZED STEEL,35,JUMBO CASE,1855,furious
955,blue olive tan rosy navajo,Manufacturer#3,Brand#32,PROMO BURNISHED STEEL,43,SM CASE,1856,tions
956,orchid yellow dark lawn thistle,Manufacturer#1,Brand#13,STANDARD BRUSHED STEEL,7,LG CASE,1857,furiously pending d
957,snow turquoise coral lime goldenrod,Manufacturer#3,Brand#33,SMALL ANODIZED COPPER,23,SM CAN,1858,ndencies wake s
958,turquoise sandy drab dodger cyan,Manufacturer#3,Brand#35,LARGE PLATED NICKEL,13,LG BOX,1859,quickly careful i
959,sky snow peach olive spring,Manufacturer#4,Brand#41,SMALL BURNISHED STEEL,5,WRAP JAR,1860,iously bold depos
960,sienna royal light orchid moccasin,Manufacturer#5,Brand#55,LARGE PLATED COPPER,26,LG CASE,1861,lly b
961,cornflower chocolate floral burnished green,Manufacturer#1,Brand#15,PROMO BRUSHED BRASS,1,SM PACK,1862,fully. f
962,magenta linen ghost almond floral,Manufacturer#1,Brand#13,MEDIUM PLATED BRASS,38,JUMBO BOX,1863,lithely. 
963,violet beige lime dark metallic,Manufacturer#4,Brand#44,MEDIUM PLATED BRASS,44,LG CASE,1864,y final deposits wake.
964,sky orange indian pale burlywood,Manufacturer#5,Brand#54,SMALL POLISHED BRASS,48,MED BOX,1865,nal asymptotes. regul
965,dim cyan bisque black smoke,Manufacturer#3,Brand#34,MEDIUM PLATED STEEL,39,LG PKG,1866,dolite
966,turquoise antique brown violet plum,Manufacturer#4,Brand#42,PROMO BURNISHED TIN,24,MED CAN,1867," the carefully "
967,cyan snow azure slate papaya,Manufacturer#5,Brand#55,SMALL BURNISHED COPPER,16,JUMBO CAN,1868,leep fur
968,rose chiffon chocolate lace papaya,Manufacturer#1,Brand#11,LARGE PLATED TIN,23,LG PKG,1869,press accounts acro
969,hot azure royal red dark,Manufacturer#5,Brand#55,PROMO POLISHED STEEL,34,JUMBO CASE,1870,le aga
970,sienna azure light medium green,Manufacturer#1,Brand#11,STANDARD BURNISHED STEEL,44,SM CAN,1871,ironic 
971,orange misty green aquamarine forest,Manufacturer#5,Brand#54,LARGE POLISHED BRASS,19,SM DRUM,1872,ugouts. bl
972,tomato burlywood pale moccasin plum,Manufacturer#3,Brand#32,MEDIUM PLATED BRASS,21,JUMBO JAR,1873,yly ironic deposits
973,medium lavender blue tomato slate,Manufacturer#2,Brand#22,STANDARD ANODIZED STEEL,42,LG PACK,1874,along 
974,almond steel slate sky rose,Manufacturer#4,Brand#44,MEDIUM ANODIZED BRASS,35,WRAP BAG,1875,s. caref
975,moccasin tomato peach yellow drab,Manufacturer#3,Brand#34,MEDIUM ANODIZED COPPER,22,LG JAR,1876,torni
976,white maroon firebrick snow light,Manufacturer#5,Brand#51,STANDARD BRUSHED NICKEL,19,JUMBO PACK,1877," special reque"
977,frosted tomato deep burnished indian,Manufacturer#5,Brand#53,STANDARD BRUSHED STEEL,2,LG CASE,1878,the quick
978,cream tomato rose floral steel,Manufacturer#4,Brand#45,MEDIUM POLISHED TIN,46,LG DRUM,1879,quests sleep abo
979,blush cyan azure snow sandy,Manufacturer#4,Brand#45,STANDARD ANODIZED TIN,4,MED CAN,1880," accounts. blithe"
980,saddle burlywood drab deep red,Manufacturer#4,Brand#41,SMALL ANODIZED STEEL,45,LG CASE,1881,ronic deposi
981,floral blanched papaya khaki light,Manufacturer#2,Brand#25,MEDIUM POLISHED COPPER,31,WRAP CAN,1882," ironic as"
982,drab steel linen puff rosy,Manufacturer#3,Brand#31,SMALL POLISHED BRASS,28,SM BAG,1883,boost blithely
983,violet mint moccasin black olive,Manufacturer#4,Brand#43,ECONOMY POLISHED TIN,39,MED BOX,1884," pack"
984,tan frosted antique midnight thistle,Manufacturer#2,Brand#22,LARGE PLATED TIN,40,SM BAG,1885,ly. furiously pe
985,drab rosy orange peach medium,Manufacturer#5,Brand#53,MEDIUM BURNISHED STEEL,10,JUMBO PKG,1886,s beside
986,forest purple lawn yellow azure,Manufacturer#3,Brand#33,PROMO BRUSHED BRASS,50,JUMBO DRUM,1887,ronic foxes
987,seashell pink linen salmon khaki,Manufacturer#5,Brand#53,PROMO POLISHED BRASS,39,LG BOX,1888,furiou
988,rose saddle linen peach cream,Manufacturer#2,Brand#24,STANDARD BURNISHED COPPER,27,WRAP PKG,1889,special requests sleep
989,misty ivory plum tan steel,Manufacturer#5,Brand#55,LARGE PLATED TIN,9,JUMBO JAR,1890,lets. e
990,azure cornsilk indian floral aquamarine,Manufacturer#1,Brand#14,SMALL BURNISHED COPPER,14,SM BAG,1891,quick
991,indian yellow red lime seashell,Manufacturer#3,Brand#32,MEDIUM POLISHED BRASS,9,SM CASE,1892,ickly slowly spe
992,hot peru beige magenta metallic,Manufacturer#5,Brand#51,PROMO BURNISHED COPPER,39,JUMBO BOX,1893," haggle"
993,chiffon papaya lavender tomato spring,Manufacturer#5,Brand#54,MEDIUM BRUSHED NICKEL,2,MED JAR,1894,bold pear
994,almond saddle papaya seashell burlywood,Manufacturer#2,Brand#25,PROMO ANODIZED STEEL,38,JUMBO BOX,1895,ost slyly. boldly bo
995,papaya violet navy khaki sky,Manufacturer#3,Brand#34,ECONOMY BRUSHED TIN,47,MED DRUM,1896,ke furiously fluffily 
996,slate pink navajo orange firebrick,Manufacturer#3,Brand#31,STANDARD POLISHED COPPER,13,LG CAN,1897,ously
997,khaki lawn rose drab cornsilk,Manufacturer#5,Brand#51,STANDARD ANODIZED BRASS,22,JUMBO BAG,1898,riously final 
998,ivory maroon cream red peru,Manufacturer#5,Brand#53,STANDARD BRUSHED NICKEL,2,MED BOX,1899,s. bold requests wake 
999,indian honeydew chartreuse navy cyan,Manufacturer#4,Brand#44,STANDARD PLATED STEEL,16,WRAP CAN,1900,ans. slyly expre
1000,wheat frosted chiffon aquamarine saddle,Manufacturer#2,Brand#24,ECONOMY BRUSHED NICKEL,10,SM DRUM,901,g fluf
1001,plum ivory wheat thistle salmon,Manufacturer#5,Brand#53,LARGE BRUSHED NICKEL,29,WRAP PACK,902,posits x-ray acros
1002,khaki dark blush moccasin floral,Manufacturer#3,Brand#31,SMALL ANODIZED NICKEL,5,MED PKG,903,y ironic instructions
1003,khaki white violet tan forest,Manufacturer#1,Brand#14,ECONOMY ANODIZED STEEL,19,JUMBO BOX,904,en id
1004,light navy deep papaya olive,Manufacturer#2,Brand#21,LARGE BRUSHED BRASS,16,WRAP CASE,905,ckly ironic 
1005,seashell orange firebrick peach rose,Manufacturer#5,Brand#52,PROMO BRUSHED STEEL,39,WRAP CAN,906,even accounts s
1006,tan tomato burlywood drab midnight,Manufacturer#1,Brand#11,MEDIUM POLISHED COPPER,3,WRAP CASE,907,"express, even packag"
1007,dodger navajo navy peru salmon,Manufacturer#1,Brand#14,ECONOMY PLATED TIN,9,JUMBO PKG,908,deas believe a
1008,puff cyan beige tan blue,Manufacturer#5,Brand#55,PROMO PLATED TIN,8,LG DRUM,909,intain
1009,sandy ghost steel cornsilk pale,Manufacturer#4,Brand#42,MEDIUM BURNISHED NICKEL,47,SM JAR,910,agains
1010,peach chocolate orange green lawn,Manufacturer#4,Brand#43,SMALL BURNISHED NICKEL,38,JUMBO DRUM,911,pinto be
1011,rosy metallic grey blush tomato,Manufacturer#5,Brand#54,ECONOMY PLATED STEEL,37,LG BOX,912,ely pending d
1012,dim cornflower powder bisque tomato,Manufacturer#4,Brand#44,SMALL ANODIZED COPPER,23,JUMBO JAR,913,kages after the sl
1013,sienna maroon chocolate honeydew brown,Manufacturer#2,Brand#24,STANDARD BRUSHED STEEL,14,JUMBO BOX,914,uests. furiously
1014,peach burlywood bisque blanched chocolate,Manufacturer#5,Brand#54,LARGE PLATED COPPER,13,WRAP CAN,915,theodolites are fur
1015,cornflower brown rosy seashell mint,Manufacturer#4,Brand#41,MEDIUM BRUSHED BRASS,15,MED CAN,916,ial deposits. acc
1016,slate blush misty azure honeydew,Manufacturer#1,Brand#14,STANDARD POLISHED BRASS,40,SM PKG,917,ter the unus
1017,purple lace lemon firebrick maroon,Manufacturer#1,Brand#15,STANDARD ANODIZED BRASS,13,LG CASE,918," regular dependencies"
1018,tan chiffon wheat plum brown,Manufacturer#4,Brand#41,MEDIUM PLATED COPPER,35,SM PACK,919,ole. final d
1019,mint rosy midnight red frosted,Manufacturer#4,Brand#41,MEDIUM ANODIZED COPPER,18,SM BOX,920,sts. furious
1020,moccasin pale cornsilk linen aquamarine,Manufacturer#3,Brand#31,LARGE POLISHED TIN,8,WRAP CASE,921,e furiously car
1021,navy wheat gainsboro red light,Manufacturer#3,Brand#33,PROMO ANODIZED TIN,46,JUMBO BAG,922,ckages above th
1022,slate mint plum drab khaki,Manufacturer#1,Brand#13,SMALL BURNISHED COPPER,33,WRAP CAN,923,sly quickly 
1023,grey blanched mint firebrick snow,Manufacturer#2,Brand#24,PROMO POLISHED COPPER,50,SM CASE,924,ideas use slyly. care
1024,maroon sienna puff ghost chiffon,Manufacturer#5,Brand#55,SMALL POLISHED COPPER,2,MED PACK,925,ges ar
1025,olive pale steel peru coral,Manufacturer#2,Brand#25,STANDARD ANODIZED COPPER,25,LG DRUM,926,ilent 
1026,slate smoke hot lawn red,Manufacturer#4,Brand#41,ECONOMY ANODIZED TIN,47,SM CAN,927,counts maintain theo
1027,powder aquamarine papaya floral puff,Manufacturer#3,Brand#31,PROMO ANODIZED NICKEL,9,JUMBO BAG,928,riously ironic platel
1028,blue drab lime khaki sienna,Manufacturer#1,Brand#12,PROMO BRUSHED COPPER,14,JUMBO CAN,929,the enticing idea
1029,blue bisque lace maroon pale,Manufacturer#4,Brand#44,LARGE PLATED NICKEL,46,JUMBO PKG,930,of the requests. qu
1030,orange floral olive ivory lace,Manufacturer#2,Brand#21,STANDARD BRUSHED STEEL,20,MED JAR,931,uriously b
1031,cyan royal metallic coral white,Manufacturer#3,Brand#32,MEDIUM BURNISHED NICKEL,13,SM BAG,932,nally! ironic requ
1032,lime lace dodger tan azure,Manufacturer#1,Brand#15,ECONOMY ANODIZED BRASS,32,LG BAG,933,arefully regul
1033,drab chiffon lace plum white,Manufacturer#1,Brand#12,MEDIUM PLATED BRASS,23,MED JAR,934,cajole bl
1034,lavender ghost sky beige navy,Manufacturer#5,Brand#52,ECONOMY POLISHED BRASS,46,LG DRUM,935,tructi
1035,black pink plum blanched linen,Manufacturer#5,Brand#52,STANDARD BRUSHED COPPER,13,MED CASE,936,hless 
1036,misty lawn navajo peach thistle,Manufacturer#3,Brand#35,MEDIUM BRUSHED COPPER,46,WRAP BAG,937,accounts 
1037,burnished frosted chocolate aquamarine ivory,Manufacturer#1,Brand#15,ECONOMY ANODIZED STEEL,36,JUMBO JAR,938," even, spec"
1038,sandy lavender rosy metallic salmon,Manufacturer#4,Brand#44,STANDARD BRUSHED STEEL,40,WRAP CAN,939,kages use a
1039,turquoise firebrick mint bisque spring,Manufacturer#3,Brand#34,MEDIUM PLATED TIN,32,MED BAG,940," regular,"
1040,floral misty smoke royal puff,Manufacturer#3,Brand#31,MEDIUM BRUSHED STEEL,40,WRAP PKG,941,furiously express re
1041,royal blanched blue peru ghost,Manufacturer#5,Brand#54,LARGE ANODIZED NICKEL,12,WRAP CAN,942,e the 
1042,almond bisque steel rosy burlywood,Manufacturer#3,Brand#32,ECONOMY BURNISHED NICKEL,42,JUMBO BAG,943,to eat 
1043,seashell lace magenta spring chiffon,Manufacturer#4,Brand#41,ECONOMY BURNISHED COPPER,32,SM CAN,944,express
1044,dodger papaya goldenrod antique brown,Manufacturer#2,Brand#25,STANDARD PLATED TIN,25,MED CAN,945,ounts. iro
1045,aquamarine light lemon sandy khaki,Manufacturer#3,Brand#35,ECONOMY ANODIZED STEEL,24,JUMBO CASE,946,blithely iron
1046,lime cornflower indian dark chiffon,Manufacturer#2,Brand#23,SMALL POLISHED STEEL,33,MED JAR,947,final pinto beans
1047,cornflower hot lace navy chocolate,Manufacturer#5,Brand#54,STANDARD ANODIZED BRASS,18,LG DRUM,948,c instructions
1048,deep turquoise light pale saddle,Manufacturer#2,Brand#24,MEDIUM BRUSHED STEEL,50,LG PACK,949,even accounts. fu
1049,goldenrod dodger cyan orchid bisque,Manufacturer#5,Brand#52,SMALL BRUSHED NICKEL,2,LG CASE,950,into beans. slyly 
1050,purple cornsilk navajo firebrick burlywood,Manufacturer#3,Brand#34,STANDARD BRUSHED BRASS,4,MED CASE,951,tly regul
1051,orchid lemon almond yellow linen,Manufacturer#1,Brand#15,ECONOMY POLISHED BRASS,12,MED PKG,952,haggle. fluffily reg
1052,dodger wheat steel grey sky,Manufacturer#5,Brand#55,PROMO PLATED TIN,11,WRAP CASE,953,side of 
1053,rosy cornsilk beige mint plum,Manufacturer#5,Brand#54,ECONOMY BRUSHED TIN,19,LG JAR,954," accounts. daring "
1054,sky smoke mint floral metallic,Manufacturer#2,Brand#24,LARGE BRUSHED STEEL,35,LG CAN,955,ggle blithe
1055,slate wheat steel chiffon royal,Manufacturer#1,Brand#14,LARGE POLISHED COPPER,18,MED BAG,956,haggle p
1056,coral peach medium pale light,Manufacturer#4,Brand#43,MEDIUM ANODIZED COPPER,13,JUMBO PKG,957,furiously even reques
1057,tomato linen papaya khaki plum,Manufacturer#1,Brand#12,ECONOMY PLATED BRASS,25,LG BOX,958,ual requests ar
1058,salmon blue almond red aquamarine,Manufacturer#5,Brand#53,ECONOMY ANODIZED COPPER,24,MED DRUM,959,sts. 
1059,orange ghost firebrick peru cornsilk,Manufacturer#4,Brand#43,MEDIUM ANODIZED TIN,40,JUMBO BOX,960,structions 
1060,dark indian snow cornflower cream,Manufacturer#3,Brand#33,STANDARD POLISHED BRASS,46,SM CASE,961,final ideas. fina
1061,pink beige orange pale powder,Manufacturer#1,Brand#15,MEDIUM BURNISHED TIN,50,LG BAG,962,n depende
1062,floral aquamarine olive red spring,Manufacturer#1,Brand#12,LARGE POLISHED TIN,12,JUMBO DRUM,963,quests are stealth
1063,lavender thistle navajo grey tan,Manufacturer#5,Brand#55,SMALL BURNISHED BRASS,42,MED BAG,964," pinto be"
1064,frosted orchid blanched seashell steel,Manufacturer#3,Brand#31,SMALL PLATED NICKEL,4,SM PKG,965,onic pinto beans
1065,coral beige sandy olive steel,Manufacturer#4,Brand#43,STANDARD PLATED TIN,14,JUMBO CASE,966,ing deposits. blith
1066,khaki spring ghost orchid metallic,Manufacturer#3,Brand#31,SMALL BURNISHED NICKEL,30,SM CASE,967,fully across the unus
1067,medium brown blanched grey chocolate,Manufacturer#3,Brand#33,SMALL BRUSHED BRASS,39,MED BOX,968,final plate
1068,antique rosy frosted almond tan,Manufacturer#1,Brand#11,ECONOMY ANODIZED NICKEL,33,MED BOX,969,ously regular
1069,mint linen seashell khaki bisque,Manufacturer#5,Brand#55,SMALL PLATED TIN,1,LG DRUM,970," the carefu"
1070,lawn mint deep dim blush,Manufacturer#4,Brand#45,SMALL POLISHED BRASS,31,WRAP DRUM,971," beans al"
1071,pink orchid tan cyan navy,Manufacturer#2,Brand#22,SMALL BURNISHED STEEL,23,WRAP DRUM,972,ong the c
1072,floral cornsilk grey purple saddle,Manufacturer#2,Brand#22,LARGE ANODIZED BRASS,31,SM PACK,973,"ithes-- furious,"
1073,midnight cyan bisque white yellow,Manufacturer#2,Brand#22,MEDIUM BRUSHED BRASS,14,LG PACK,974,posits. furiously 
1074,midnight peach purple coral azure,Manufacturer#5,Brand#53,STANDARD ANODIZED NICKEL,46,LG PACK,975,silent foxes nag furi
1075,cream honeydew burlywood light pale,Manufacturer#2,Brand#21,LARGE ANODIZED NICKEL,33,LG PACK,976," carefully un"
1076,lime black dim lemon mint,Manufacturer#1,Brand#13,PROMO BRUSHED BRASS,18,JUMBO CASE,977,. carefully enticing i
1077,gainsboro navajo mint cornflower grey,Manufacturer#4,Brand#41,STANDARD ANODIZED TIN,49,MED BAG,978,into beans. 
1078,blanched misty turquoise black plum,Manufacturer#4,Brand#41,SMALL BRUSHED NICKEL,22,WRAP CAN,979,ly among the care
1079,plum chartreuse hot beige lime,Manufacturer#2,Brand#25,STANDARD ANODIZED COPPER,22,SM CASE,980,"gular, regu"
1080,khaki light black ghost yellow,Manufacturer#5,Brand#52,STANDARD PLATED COPPER,21,JUMBO PKG,981," to the reg"
1081,dark powder hot chartreuse moccasin,Manufacturer#1,Brand#15,PROMO POLISHED NICKEL,44,SM PKG,982,s. depo
1082,cream magenta lavender firebrick purple,Manufacturer#1,Brand#11,SMALL ANODIZED TIN,45,JUMBO PKG,983," throughout the"
1083,almond khaki chartreuse hot seashell,Manufacturer#1,Brand#11,ECONOMY PLATED COPPER,20,JUMBO CASE,984,out the ca
1084,gainsboro blanched chiffon orchid dim,Manufacturer#2,Brand#22,STANDARD BRUSHED TIN,10,JUMBO BAG,985,ptotes. carefully ruth
1085,floral frosted seashell light red,Manufacturer#4,Brand#45,PROMO PLATED COPPER,26,LG CAN,986,anent notornis about 
1086,wheat lemon powder seashell green,Manufacturer#4,Brand#45,LARGE BRUSHED COPPER,49,SM DRUM,987,ecial request
1087,purple maroon cornflower red thistle,Manufacturer#4,Brand#42,LARGE ANODIZED COPPER,32,MED CASE,988,fluffily silent accou
1088,turquoise papaya dim hot navajo,Manufacturer#3,Brand#35,SMALL ANODIZED STEEL,7,MED CAN,989,above the furious
1089,slate goldenrod purple peach dim,Manufacturer#2,Brand#24,LARGE BURNISHED TIN,26,WRAP CASE,990,dolites sleep acros
1090,floral spring navy misty azure,Manufacturer#1,Brand#13,SMALL PLATED TIN,6,MED PKG,991,furiously reg
1091,midnight blue misty steel ghost,Manufacturer#2,Brand#22,LARGE BURNISHED STEEL,45,SM PKG,992,kly b
1092,sienna dodger olive misty deep,Manufacturer#1,Brand#12,STANDARD ANODIZED BRASS,3,SM PKG,993,y bold asympt
1093,green azure puff metallic lace,Manufacturer#2,Brand#25,STANDARD ANODIZED TIN,9,JUMBO BOX,994,ach evenly regu
1094,papaya moccasin powder rose bisque,Manufacturer#4,Brand#42,SMALL ANODIZED COPPER,2,SM PKG,995,excuses use 
1095,green blue royal coral indian,Manufacturer#3,Brand#35,MEDIUM BURNISHED TIN,24,JUMBO DRUM,996,iously. silent 
1096,frosted burlywood honeydew pink lawn,Manufacturer#5,Brand#51,SMALL PLATED NICKEL,33,LG DRUM,997,furiousl
1097,dim antique dark blanched pink,Manufacturer#3,Brand#31,ECONOMY BRUSHED STEEL,1,JUMBO CASE,998,unts. quickly
1098,lace hot bisque firebrick lawn,Manufacturer#2,Brand#21,ECONOMY POLISHED STEEL,44,JUMBO BAG,999,e ironic a
1099,coral orchid grey lavender misty,Manufacturer#3,Brand#32,PROMO PLATED COPPER,43,LG DRUM,1000," idly silent dol"
1100,lawn navajo white honeydew steel,Manufacturer#4,Brand#41,ECONOMY BRUSHED STEEL,8,MED PKG,1001,regular pinto bea
1101,burlywood moccasin steel grey powder,Manufacturer#5,Brand#53,STANDARD POLISHED BRASS,21,JUMBO BOX,1002,s. theodolites 
1102,peach chocolate burnished steel khaki,Manufacturer#4,Brand#45,PROMO PLATED COPPER,21,SM CAN,1003,", bol"
1103,midnight chocolate slate rosy lace,Manufacturer#5,Brand#53,ECONOMY ANODIZED BRASS,35,LG DRUM,1004,lyly. carefully 
1104,navajo goldenrod powder grey violet,Manufacturer#2,Brand#23,MEDIUM BRUSHED TIN,22,MED BAG,1005,ndencies. furio
1105,brown olive black seashell lavender,Manufacturer#2,Brand#25,MEDIUM PLATED COPPER,7,JUMBO DRUM,1006,ely regular theodo
1106,brown floral light black orchid,Manufacturer#1,Brand#14,MEDIUM ANODIZED TIN,25,WRAP BAG,1007,ructions are
1107,forest sandy wheat blue snow,Manufacturer#3,Brand#34,ECONOMY BRUSHED COPPER,47,LG DRUM,1008,oss the fluffily final
1108,azure dark sienna black wheat,Manufacturer#1,Brand#13,MEDIUM POLISHED BRASS,24,WRAP CASE,1009,hely ironic
1109,azure lime gainsboro orchid firebrick,Manufacturer#5,Brand#54,ECONOMY BURNISHED NICKEL,13,JUMBO PACK,1010,nal packages boost flu
1110,light lavender smoke gainsboro pink,Manufacturer#4,Brand#44,STANDARD BURNISHED TIN,41,WRAP CAN,1011,es use blithely ev
1111,sienna powder magenta peach drab,Manufacturer#1,Brand#11,LARGE BRUSHED COPPER,41,WRAP CAN,1012,d pinto beans cajole. 
1112,orchid dodger blush seashell chiffon,Manufacturer#1,Brand#11,MEDIUM BRUSHED COPPER,21,JUMBO CASE,1013," use package"
1113,cornflower navy smoke chartreuse snow,Manufacturer#3,Brand#33,ECONOMY BURNISHED STEEL,39,SM PACK,1014," blithely regular "
1114,lime moccasin seashell orange coral,Manufacturer#4,Brand#43,LARGE POLISHED COPPER,43,MED DRUM,1015,nts. ironic
1115,green saddle bisque goldenrod peach,Manufacturer#2,Brand#24,PROMO PLATED NICKEL,47,LG CAN,1016,yly regula
1116,saddle tan cyan red navajo,Manufacturer#3,Brand#34,ECONOMY ANODIZED TIN,49,JUMBO CASE,1017,etly clo
1117,salmon saddle mint snow antique,Manufacturer#1,Brand#13,PROMO BURNISHED COPPER,28,WRAP PACK,1018,s use blithely. fl
1118,midnight yellow steel dodger rose,Manufacturer#5,Brand#55,SMALL POLISHED NICKEL,37,SM BOX,1019,encies affix acr
1119,brown mint lavender moccasin slate,Manufacturer#1,Brand#14,ECONOMY BRUSHED NICKEL,24,WRAP JAR,1020,s according
1120,steel slate black purple indian,Manufacturer#2,Brand#22,SMALL PLATED TIN,1,MED CASE,1021,bout the slow foxes.
1121,rose lemon sky beige aquamarine,Manufacturer#3,Brand#35,LARGE BRUSHED STEEL,25,LG JAR,1022,ven instructi
1122,tomato thistle grey slate dark,Manufacturer#4,Brand#44,STANDARD BRUSHED NICKEL,7,SM BAG,1023,bold theod
1123,olive lavender saddle green grey,Manufacturer#2,Brand#23,ECONOMY BURNISHED NICKEL,29,WRAP BAG,1024," pinto beans; slyl"
1124,green magenta lime dim brown,Manufacturer#2,Brand#22,MEDIUM BURNISHED TIN,23,WRAP JAR,1025,ckages nag carefully
1125,peach deep cornflower thistle brown,Manufacturer#2,Brand#23,SMALL PLATED NICKEL,12,WRAP DRUM,1026,uickly final deposit
1126,sky chartreuse drab violet goldenrod,Manufacturer#2,Brand#23,MEDIUM BURNISHED TIN,27,LG PACK,1027,"he ironic, iron"
1127,black drab deep blue maroon,Manufacturer#2,Brand#22,SMALL PLATED STEEL,37,SM PKG,1028,hockey players. even 
1128,grey tan lawn violet cornflower,Manufacturer#5,Brand#52,STANDARD POLISHED STEEL,19,SM CAN,1029,hely so
1129,tan orchid yellow hot rosy,Manufacturer#4,Brand#44,SMALL ANODIZED TIN,45,SM JAR,1030,odolite
1130,beige blue wheat medium khaki,Manufacturer#4,Brand#45,STANDARD PLATED STEEL,27,SM DRUM,1031,ges. packages nag sl
