P_PARTKEY,P_NAME,P_MFGR,P_BRAND,P_TYPE,P_SIZE,P_CONTAINER,P_RETAILPRICE,P_COMMENT
453,lemon navy seashell khaki sienna,Manufacturer#3,Brand#34,ECONOMY ANODIZED TIN,20,LG CASE,1353,y above the pen
454,royal lime saddle magenta violet,Manufacturer#5,Brand#53,MEDIUM BURNISHED STEEL,32,LG BOX,1354,ual requests.
455,aquamarine blanched misty moccasin sky,Manufacturer#2,Brand#22,LARGE BRUSHED BRASS,18,MED JAR,1355,ongside of the careful
456,antique maroon olive turquoise lace,Manufacturer#5,Brand#53,PROMO POLISHED BRASS,40,SM PKG,1356,"usual,"
457,navy linen forest moccasin slate,Manufacturer#5,Brand#52,SMALL POLISHED TIN,46,SM CAN,1357,express accounts. sp
458,beige papaya grey ivory white,Manufacturer#2,Brand#22,PROMO BRUSHED COPPER,38,MED BAG,1358,structions sleep 
459,beige slate magenta dim salmon,Manufacturer#2,Brand#23,MEDIUM ANODIZED NICKEL,27,SM PACK,1359," blithely. fur"
460,maroon papaya orange spring light,Manufacturer#3,Brand#35,STANDARD ANODIZED BRASS,47,JUMBO DRUM,1360,he carefully
461,goldenrod dim wheat tan violet,Manufacturer#5,Brand#54,SMALL BRUSHED TIN,44,JUMBO CASE,1361,: slyly express pa
462,lime yellow sandy floral khaki,Manufacturer#5,Brand#54,MEDIUM BURNISHED BRASS,11,WRAP CAN,1362,s sleep quickly care
463,steel cream grey mint dark,Manufacturer#2,Brand#21,MEDIUM ANODIZED COPPER,48,MED PACK,1363,unts use fluffily
464,azure magenta lace smoke ghost,Manufacturer#4,Brand#42,LARGE BURNISHED NICKEL,34,LG BOX,1364,l decoys. close exc
465,smoke sky bisque ghost black,Manufacturer#4,Brand#42,SMALL POLISHED BRASS,12,MED JAR,1365,nts. slyly special ac
466,deep ghost cornflower ivory burnished,Manufacturer#3,Brand#33,PROMO POLISHED BRASS,12,LG PKG,1366,ly special pains. iron
467,cornflower lime midnight plum forest,Manufacturer#2,Brand#24,STANDARD BURNISHED STEEL,48,JUMBO PACK,1367,ependenc
468,spring grey azure khaki lace,Manufacturer#4,Brand#41,MEDIUM BURNISHED STEEL,24,SM PACK,1368,o the
469,burlywood dark steel sky blue,Manufacturer#1,Brand#13,MEDIUM POLISHED STEEL,43,WRAP PKG,1369,osits. slyly unusua
470,honeydew lime khaki saddle indian,Manufacturer#2,Brand#24,STANDARD BRUSHED TIN,38,JUMBO CASE,1370,ess deposits
471,goldenrod honeydew frosted almond chiffon,Manufacturer#1,Brand#11,LARGE BRUSHED STEEL,21,JUMBO BAG,1371,sits nag caref
472,dim misty lime purple cornsilk,Manufacturer#3,Brand#31,PROMO BRUSHED COPPER,24,SM JAR,1372," according"
473,moccasin antique lace peach chiffon,Manufacturer#1,Brand#12,ECONOMY PLATED STEEL,2,MED DRUM,1373,e furious
474,papaya green royal burlywood saddle,Manufacturer#1,Brand#14,ECONOMY PLATED STEEL,45,LG PACK,1374,ously even reques
475,coral peru forest thistle khaki,Manufacturer#3,Brand#34,STANDARD ANODIZED NICKEL,30,MED PACK,1375,thely unusual th
476,cornflower deep turquoise slate sandy,Manufacturer#3,Brand#33,STANDARD POLISHED COPPER,33,WRAP PACK,1376," according to the blit"
477,plum peru spring firebrick lavender,Manufacturer#1,Brand#11,ECONOMY ANODIZED COPPER,35,JUMBO BAG,1377,lent s
478,lemon snow coral lime seashell,Manufacturer#4,Brand#45,STANDARD POLISHED COPPER,11,MED CASE,1378,ly bold foxes ca
479,snow frosted slate magenta sky,Manufacturer#2,Brand#25,MEDIUM PLATED STEEL,35,SM BAG,1379," pending ac"
480,saddle light black drab navajo,Manufacturer#5,Brand#54,MEDIUM ANODIZED STEEL,31,WRAP BOX,1380,eans. quickly
481,slate red firebrick beige aquamarine,Manufacturer#1,Brand#14,MEDIUM BURNISHED BRASS,17,JUMBO PACK,1381,s cajole som
482,burnished spring azure green chocolate,Manufacturer#5,Brand#53,MEDIUM POLISHED STEEL,11,SM DRUM,1382,deposits. fluffily b
483,deep white khaki floral cornflower,Manufacturer#1,Brand#15,MEDIUM ANODIZED COPPER,9,SM PKG,1383,usly final instru
484,bisque rosy olive peach chiffon,Manufacturer#1,Brand#15,MEDIUM POLISHED BRASS,34,SM CASE,1384,uffily final deposits.
485,orchid dark antique deep ivory,Manufacturer#3,Brand#31,PROMO PLATED STEEL,44,LG JAR,1385," requests. regularly r"
486,tomato lime moccasin turquoise grey,Manufacturer#4,Brand#45,SMALL PLATED COPPER,15,MED PKG,1386,ent accounts among t
487,firebrick saddle chocolate peru ghost,Manufacturer#5,Brand#52,SMALL BRUSHED COPPER,43,WRAP PACK,1387,iously ruthles
488,forest puff drab beige blue,Manufacturer#2,Brand#21,PROMO PLATED BRASS,47,JUMBO JAR,1388," the slyly pending r"
489,smoke green blush deep royal,Manufacturer#2,Brand#22,LARGE BURNISHED TIN,36,LG CAN,1389,unts. quickly bold id
490,yellow mint saddle dodger orchid,Manufacturer#4,Brand#41,SMALL PLATED NICKEL,11,MED BOX,1390,fluffily express packa
491,snow mint rose almond frosted,Manufacturer#3,Brand#31,SMALL POLISHED BRASS,42,MED JAR,1391," deposit"
492,turquoise rose navajo deep chiffon,Manufacturer#4,Brand#42,MEDIUM BRUSHED COPPER,13,JUMBO DRUM,1392,yly slyly express th
493,blue gainsboro sky burnished puff,Manufacturer#4,Brand#45,MEDIUM BURNISHED BRASS,8,MED PKG,1393,uses. bold 
494,navy pale frosted lawn spring,Manufacturer#4,Brand#42,STANDARD BRUSHED NICKEL,40,MED PKG,1394,y pending theodo
495,lemon burlywood chartreuse forest honeydew,Manufacturer#4,Brand#42,SMALL BRUSHED BRASS,28,MED PKG,1395,", ironic pac"
496,orchid bisque antique ivory lavender,Manufacturer#1,Brand#12,STANDARD BRUSHED BRASS,11,SM BAG,1396,ealthily
497,hot powder dim cream metallic,Manufacturer#2,Brand#25,PROMO PLATED TIN,1,SM CAN,1397,l accounts sl
498,sandy sky gainsboro peach cornflower,Manufacturer#2,Brand#25,MEDIUM POLISHED STEEL,21,WRAP CASE,1398,lthily even co
499,lemon pale blue burnished white,Manufacturer#3,Brand#35,SMALL PLATED COPPER,38,JUMBO PKG,1399,furiously across 
500,hot medium spring orange violet,Manufacturer#4,Brand#41,MEDIUM POLISHED STEEL,13,SM JAR,1401,regul
501,tomato navy midnight cyan chiffon,Manufacturer#4,Brand#45,SMALL BURNISHED COPPER,37,SM BAG,1402,press pinto b
502,maroon dark plum brown red,Manufacturer#2,Brand#21,SMALL PLATED TIN,6,JUMBO DRUM,1403,quests integrate 
503,lavender cyan red lace light,Manufacturer#2,Brand#24,PROMO BRUSHED NICKEL,30,SM PKG,1404," the dep"
504,pink tan papaya ivory lace,Manufacturer#2,Brand#24,PROMO BRUSHED STEEL,10,SM JAR,1405,refully after the fu
505,pink cornsilk antique mint forest,Manufacturer#4,Brand#42,STANDARD PLATED BRASS,32,WRAP JAR,1406,ly even 
506,beige floral goldenrod lace almond,Manufacturer#1,Brand#14,PROMO BRUSHED NICKEL,30,WRAP PACK,1407,"y ruthless, fi"
507,red misty salmon ivory khaki,Manufacturer#4,Brand#43,SMALL ANODIZED BRASS,20,SM CASE,1408,ial foxes. furiously 
508,pale peach maroon burlywood tan,Manufacturer#1,Brand#14,LARGE ANODIZED TIN,40,WRAP PKG,1409,ect according
509,tomato cornsilk chartreuse blue magenta,Manufacturer#1,Brand#13,MEDIUM BRUSHED NICKEL,30,MED CAN,1410,eposits. slyly
510,blush thistle orchid red lace,Manufacturer#4,Brand#43,SMALL PLATED NICKEL,25,JUMBO PACK,1411,al platelets. iro
511,red pale plum orchid moccasin,Manufacturer#1,Brand#15,STANDARD BRUSHED COPPER,2,LG JAR,1412,ss package
512,firebrick azure mint chocolate wheat,Manufacturer#5,Brand#51,PROMO ANODIZED COPPER,18,LG PACK,1413,dolphins cajo
513,mint thistle chiffon magenta salmon,Manufacturer#3,Brand#32,MEDIUM BRUSHED STEEL,10,WRAP CAN,1414," after th"
514,rosy sienna purple light rose,Manufacturer#4,Brand#42,LARGE POLISHED BRASS,10,JUMBO BOX,1415,omise
515,cream navajo drab dark peru,Manufacturer#5,Brand#53,MEDIUM PLATED TIN,37,WRAP BOX,1416,ular asymptotes im
516,purple linen lace blanched snow,Manufacturer#1,Brand#12,SMALL BRUSHED NICKEL,28,LG CAN,1417,ly express
517,aquamarine rosy violet moccasin snow,Manufacturer#3,Brand#34,SMALL BURNISHED COPPER,30,WRAP CAN,1418,uses. 
518,yellow tomato lawn rosy lemon,Manufacturer#4,Brand#43,PROMO BRUSHED BRASS,33,JUMBO DRUM,1419,n requests hag
519,violet medium dark red smoke,Manufacturer#3,Brand#32,LARGE BRUSHED BRASS,24,WRAP PACK,1420,xes are fluffily fluf
520,spring honeydew sky sandy almond,Manufacturer#1,Brand#12,PROMO BURNISHED BRASS,49,MED CASE,1421," foxes."
521,grey drab honeydew coral pale,Manufacturer#3,Brand#35,PROMO BRUSHED STEEL,21,JUMBO DRUM,1422,the blithe
522,frosted lawn violet turquoise coral,Manufacturer#3,Brand#32,STANDARD BRUSHED NICKEL,15,MED CASE,1423,deas. brave ac
523,light goldenrod honeydew indian lemon,Manufacturer#4,Brand#42,ECONOMY BRUSHED NICKEL,7,JUMBO JAR,1424,e blithe
524,burnished hot drab midnight tan,Manufacturer#1,Brand#14,SMALL ANODIZED STEEL,17,JUMBO PACK,1425,ly reg
525,plum midnight coral snow lemon,Manufacturer#3,Brand#33,STANDARD BURNISHED STEEL,47,JUMBO CAN,1426,ly except 
526,dodger moccasin wheat puff lace,Manufacturer#5,Brand#53,PROMO ANODIZED BRASS,47,JUMBO PKG,1427,"ronic, iro"
527,moccasin light purple sky magenta,Manufacturer#3,Brand#32,MEDIUM POLISHED NICKEL,39,LG JAR,1428,counts wake abov
528,dim deep puff pink floral,Manufacturer#2,Brand#24,STANDARD PLATED STEEL,40,LG CAN,1429,ly ironic pl
529,powder tan brown royal blush,Manufacturer#3,Brand#31,MEDIUM PLATED NICKEL,33,SM PKG,1430,y along the 
530,mint grey chiffon magenta saddle,Manufacturer#4,Brand#42,PROMO PLATED STEEL,45,JUMBO CASE,1431,kages about t
531,navajo hot forest puff olive,Manufacturer#2,Brand#22,ECONOMY POLISHED NICKEL,16,WRAP DRUM,1432," atta"
532,spring wheat purple chiffon puff,Manufacturer#1,Brand#14,LARGE BRUSHED NICKEL,45,WRAP BAG,1433,s. blithely
533,cream lemon goldenrod rosy aquamarine,Manufacturer#2,Brand#24,PROMO PLATED STEEL,38,JUMBO PACK,1434,ng the blithely final 
534,bisque saddle hot steel frosted,Manufacturer#5,Brand#53,STANDARD PLATED NICKEL,27,LG CASE,1435,rts poach over th
535,mint chocolate tomato peach sky,Manufacturer#5,Brand#53,STANDARD PLATED TIN,17,SM CASE,1436,he unusual idea
536,orchid snow thistle peru moccasin,Manufacturer#2,Brand#23,STANDARD PLATED STEEL,36,JUMBO BAG,1437,le slyl
537,hot orange red cornsilk goldenrod,Manufacturer#1,Brand#15,ECONOMY BRUSHED TIN,26,WRAP BOX,1438,fully regular platelet
538,rose black peach orchid cyan,Manufacturer#1,Brand#15,ECONOMY POLISHED STEEL,24,SM PACK,1439,ic epitap
539,dodger midnight salmon drab saddle,Manufacturer#3,Brand#34,MEDIUM BURNISHED TIN,4,SM DRUM,1440," deposits. fi"
540,violet white steel chocolate burlywood,Manufacturer#1,Brand#14,MEDIUM PLATED NICKEL,7,LG PACK,1441,"cial, pending account"
541,magenta tan antique sky pale,Manufacturer#3,Brand#35,STANDARD ANODIZED NICKEL,34,LG JAR,1442,s are fluffily above t
542,light lace gainsboro coral lavender,Manufacturer#1,Brand#11,SMALL BRUSHED STEEL,40,WRAP CASE,1443,sits bo
543,sky powder saddle metallic moccasin,Manufacturer#5,Brand#54,ECONOMY POLISHED BRASS,4,JUMBO BOX,1444," cajole "
544,peach red azure indian lavender,Manufacturer#2,Brand#22,STANDARD BURNISHED NICKEL,42,SM CASE,1445,leep slyl
545,purple peru ivory gainsboro peach,Manufacturer#3,Brand#31,LARGE PLATED NICKEL,14,MED JAR,1446,arefully regular packa
546,metallic grey black rosy papaya,Manufacturer#2,Brand#25,ECONOMY ANODIZED STEEL,8,LG CASE,1447,ly unusu
547,white turquoise olive cornflower pale,Manufacturer#4,Brand#43,MEDIUM BURNISHED COPPER,48,WRAP DRUM,1448,ial theodolites among 
548,cyan lime lawn misty mint,Manufacturer#3,Brand#33,ECONOMY ANODIZED TIN,28,SM CAN,1449,gular
549,thistle green indian sandy purple,Manufacturer#5,Brand#53,SMALL BRUSHED BRASS,36,SM CAN,1450,ly unus
550,brown blush dark white mint,Manufacturer#4,Brand#44,STANDARD BRUSHED STEEL,27,SM JAR,1451,arefully iron
551,tan misty floral firebrick puff,Manufacturer#5,Brand#54,LARGE BURNISHED TIN,10,MED JAR,1452,dolites cajole furious
552,lime violet puff snow chiffon,Manufacturer#4,Brand#44,LARGE POLISHED BRASS,1,JUMBO CAN,1453,longside of the sl
553,gainsboro tomato lawn peru bisque,Manufacturer#2,Brand#23,SMALL POLISHED NICKEL,1,WRAP DRUM,1454,fily regular depen
554,blue medium royal blush ghost,Manufacturer#5,Brand#53,STANDARD BRUSHED STEEL,31,LG JAR,1455,ts? ironically
555,midnight honeydew brown beige slate,Manufacturer#4,Brand#42,PROMO BURNISHED TIN,49,SM JAR,1456,es hag
556,frosted antique aquamarine seashell powder,Manufacturer#2,Brand#23,SMALL BRUSHED BRASS,49,WRAP JAR,1457,ar theodolites ma
557,firebrick ghost steel green chartreuse,Manufacturer#3,Brand#35,LARGE BURNISHED TIN,8,JUMBO PKG,1458,ccounts im
558,blanched seashell navy black dim,Manufacturer#3,Brand#31,STANDARD PLATED BRASS,25,MED BOX,1459,eposits. slyly
559,wheat coral navajo cornflower dark,Manufacturer#3,Brand#31,LARGE PLATED STEEL,27,SM PKG,1460,stealthily express 
560,tan indian lime olive dodger,Manufacturer#2,Brand#25,STANDARD BRUSHED COPPER,37,WRAP PKG,1461,e special pac
561,firebrick slate grey coral goldenrod,Manufacturer#1,Brand#14,SMALL POLISHED STEEL,44,JUMBO CASE,1462,"-- ironic, iron"
562,tan blue thistle forest cornsilk,Manufacturer#3,Brand#32,SMALL BURNISHED STEEL,16,MED PACK,1463," fluffi"
563,blanched light indian goldenrod dim,Manufacturer#3,Brand#31,MEDIUM POLISHED STEEL,39,MED DRUM,1464,"furiously bold,"
564,drab bisque puff ghost floral,Manufacturer#2,Brand#22,LARGE ANODIZED BRASS,41,SM PKG,1465,blithely after the ev
565,coral mint sky rosy red,Manufacturer#1,Brand#14,PROMO BRUSHED STEEL,9,JUMBO JAR,1466," blithely unusual r"
566,seashell dark yellow turquoise white,Manufacturer#2,Brand#25,ECONOMY BURNISHED TIN,19,LG PKG,1467,ounts wake across t
567,cornsilk lace white medium honeydew,Manufacturer#5,Brand#55,STANDARD BRUSHED STEEL,19,JUMBO BAG,1468,pending pinto 
568,purple burlywood pale cornsilk chartreuse,Manufacturer#3,Brand#31,PROMO POLISHED STEEL,6,SM BOX,1469,ts. ideas along t
569,cornflower burlywood blue spring purple,Manufacturer#4,Brand#41,SMALL BRUSHED TIN,46,MED BOX,1470,y according to
570,cyan navajo turquoise forest firebrick,Manufacturer#5,Brand#51,ECONOMY BRUSHED COPPER,44,SM PKG,1471,le. s
571,medium orchid purple metallic ghost,Manufacturer#2,Brand#22,LARGE PLATED TIN,1,WRAP CAN,1472,ly ironic
572,navy plum lime goldenrod saddle,Manufacturer#4,Brand#43,LARGE BURNISHED COPPER,3,SM BOX,1473,requests use
573,dark midnight forest lace sandy,Manufacturer#2,Brand#23,SMALL PLATED TIN,42,WRAP PACK,1474,expres
574,bisque snow turquoise lace blush,Manufacturer#2,Brand#23,SMALL PLATED BRASS,36,SM PACK,1475,oss th
575,brown seashell hot lavender frosted,Manufacturer#1,Brand#14,SMALL BRUSHED NICKEL,10,MED CAN,1476,ns integrate a
576,puff lavender black yellow lawn,Manufacturer#3,Brand#32,PROMO BURNISHED TIN,27,SM CAN,1477," foxes. accounts bo"
577,lime green dark misty chiffon,Manufacturer#2,Brand#22,LARGE BRUSHED STEEL,34,JUMBO BAG,1478,"ding, fur"
578,black lawn light plum blush,Manufacturer#4,Brand#41,MEDIUM ANODIZED NICKEL,9,WRAP DRUM,1479," furiously iron"
579,spring brown peach bisque sienna,Manufacturer#3,Brand#31,STANDARD POLISHED STEEL,8,WRAP JAR,1480,ades. carefully 
580,navajo chocolate lemon hot green,Manufacturer#1,Brand#12,LARGE BURNISHED COPPER,30,JUMBO PACK,1481,usly expre
581,frosted gainsboro chiffon lawn green,Manufacturer#2,Brand#25,ECONOMY ANODIZED BRASS,44,SM BAG,1482," furious foxes. silen"
582,tan cyan peach rose salmon,Manufacturer#4,Brand#45,LARGE BRUSHED TIN,23,MED JAR,1483,y bold
583,turquoise burnished orchid firebrick blush,Manufacturer#3,Brand#33,LARGE BURNISHED NICKEL,35,JUMBO CAN,1484," sleep "
584,goldenrod magenta papaya medium chiffon,Manufacturer#1,Brand#12,SMALL POLISHED COPPER,42,MED JAR,1485,"lar, ironic ac"
585,slate hot honeydew midnight burnished,Manufacturer#5,Brand#53,SMALL PLATED COPPER,7,JUMBO PKG,1486,sts haggle q
586,ivory rosy royal powder firebrick,Manufacturer#1,Brand#11,PROMO ANODIZED BRASS,11,LG DRUM,1487,ts haggle fluffily 
587,blanched maroon blush burlywood salmon,Manufacturer#4,Brand#44,SMALL POLISHED STEEL,35,MED PKG,1488,c accounts. qui
588,cyan powder brown sandy burlywood,Manufacturer#5,Brand#55,SMALL PLATED COPPER,45,WRAP BAG,1489,"ss foxes. even, ex"
589,red orange salmon rosy thistle,Manufacturer#1,Brand#13,LARGE POLISHED BRASS,3,SM PKG,1490,cies. regul
590,azure burnished honeydew navy cyan,Manufacturer#4,Brand#42,LARGE POLISHED COPPER,38,WRAP PKG,1491," dependencies sho"
591,sienna burlywood salmon navy green,Manufacturer#1,Brand#14,ECONOMY PLATED NICKEL,40,SM PKG,1492," the b"
592,dodger burnished yellow wheat antique,Manufacturer#2,Brand#23,LARGE POLISHED STEEL,7,MED DRUM,1493,ide of the notorni
593,metallic sienna sandy spring frosted,Manufacturer#2,Brand#25,PROMO POLISHED STEEL,20,JUMBO CASE,1494,ake after
594,seashell magenta rosy cornsilk smoke,Manufacturer#3,Brand#31,PROMO BRUSHED BRASS,28,SM JAR,1495,s detect fu
595,chiffon lace linen steel bisque,Manufacturer#5,Brand#51,PROMO BRUSHED BRASS,23,JUMBO JAR,1496,yly fin
596,drab snow chartreuse dim ivory,Manufacturer#5,Brand#52,STANDARD POLISHED TIN,35,JUMBO JAR,1497,epend
597,cyan orchid grey tan bisque,Manufacturer#4,Brand#44,STANDARD ANODIZED NICKEL,36,SM DRUM,1498,ronic foxes. speci
598,deep royal drab violet chartreuse,Manufacturer#2,Brand#24,MEDIUM POLISHED BRASS,9,MED JAR,1499,he fluffily regular
599,cornsilk peru steel beige blue,Manufacturer#5,Brand#51,MEDIUM BRUSHED NICKEL,30,JUMBO PACK,1500,ckages against t
600,puff bisque midnight seashell burlywood,Manufacturer#4,Brand#42,STANDARD POLISHED NICKEL,4,SM JAR,1501,ow furiously agai
601,coral thistle blanched linen tan,Manufacturer#1,Brand#13,STANDARD POLISHED BRASS,13,SM PKG,1502,lithely thi
602,metallic smoke purple rosy magenta,Manufacturer#1,Brand#12,PROMO BRUSHED COPPER,8,SM BAG,1503,telets a
603,dim blush puff chiffon salmon,Manufacturer#1,Brand#12,PROMO ANODIZED COPPER,41,WRAP PKG,1504,uests. fluffily regul
604,bisque light frosted white olive,Manufacturer#4,Brand#41,MEDIUM PLATED STEEL,19,MED PACK,1505,are after the regula
605,grey burlywood linen tan tomato,Manufacturer#1,Brand#11,LARGE POLISHED STEEL,30,LG JAR,1506," bold, final accou"
606,navajo lace sandy aquamarine light,Manufacturer#3,Brand#32,STANDARD PLATED STEEL,36,LG DRUM,1507,hins p
607,dark sienna thistle sandy maroon,Manufacturer#5,Brand#54,MEDIUM POLISHED TIN,13,MED JAR,1508,ctions wake qu
608,mint medium blush black metallic,Manufacturer#2,Brand#25,PROMO PLATED BRASS,35,JUMBO PKG,1509,xes. express r
609,almond lemon olive smoke moccasin,Manufacturer#2,Brand#21,ECONOMY BRUSHED TIN,49,JUMBO DRUM,1510,cial deposits haggle
610,plum purple seashell white lemon,Manufacturer#1,Brand#11,ECONOMY BURNISHED TIN,38,JUMBO BOX,1511,slyly pending re
611,light burnished linen sienna dim,Manufacturer#4,Brand#42,MEDIUM PLATED TIN,45,SM DRUM,1512,iously even packages. 
612,midnight azure moccasin rosy lawn,Manufacturer#4,Brand#42,PROMO PLATED STEEL,19,LG BOX,1513,se quickly;
613,cream coral sandy thistle spring,Manufacturer#3,Brand#34,LARGE BURNISHED COPPER,22,LG DRUM,1514," cajo"
614,dodger beige maroon puff medium,Manufacturer#2,Brand#23,STANDARD BURNISHED NICKEL,6,WRAP PKG,1515,ending accounts ca
615,rosy seashell brown blush tan,Manufacturer#4,Brand#41,PROMO ANODIZED COPPER,4,WRAP PKG,1516," dogged "
616,tan powder lavender dim goldenrod,Manufacturer#2,Brand#25,STANDARD BRUSHED STEEL,1,WRAP JAR,1517,w packages cajole b
617,peru grey snow papaya firebrick,Manufacturer#2,Brand#22,MEDIUM ANODIZED NICKEL,37,WRAP DRUM,1518,furious
618,ivory wheat smoke deep lemon,Manufacturer#2,Brand#22,PROMO BRUSHED BRASS,9,LG BOX,1519,ogs. furiously 
619,powder medium drab lemon tomato,Manufacturer#3,Brand#34,LARGE ANODIZED STEEL,46,MED JAR,1520,cuses are 
620,frosted tomato almond salmon powder,Manufacturer#3,Brand#35,MEDIUM BRUSHED COPPER,4,LG PKG,1521,efully carefully speci
621,almond azure drab ghost mint,Manufacturer#5,Brand#53,PROMO PLATED TIN,47,JUMBO DRUM,1522,ffily furiously fin
622,burlywood dark blue thistle navajo,Manufacturer#5,Brand#51,LARGE POLISHED STEEL,19,WRAP BAG,1523,sly deposits. f
623,chiffon bisque steel orange tomato,Manufacturer#3,Brand#32,ECONOMY POLISHED NICKEL,8,MED BOX,1524,ly ironic 
624,burlywood ghost orchid misty coral,Manufacturer#1,Brand#12,LARGE BURNISHED NICKEL,29,SM BAG,1525,dencies. even d
625,beige indian lime sienna plum,Manufacturer#3,Brand#35,SMALL PLATED COPPER,38,LG JAR,1526,blithely slow multipl
626,cream ivory brown peach honeydew,Manufacturer#1,Brand#12,SMALL ANODIZED COPPER,23,SM JAR,1527,furiously-- 
627,drab yellow spring turquoise rose,Manufacturer#4,Brand#44,PROMO ANODIZED NICKEL,13,SM BAG,1528,y ironic 
628,black mint olive drab medium,Manufacturer#3,Brand#33,ECONOMY BRUSHED BRASS,40,LG BOX,1529,sits. 
629,magenta lace red hot pale,Manufacturer#5,Brand#51,MEDIUM POLISHED COPPER,25,WRAP BOX,1530,fully even co
630,lawn lace burnished hot frosted,Manufacturer#2,Brand#25,MEDIUM PLATED NICKEL,20,LG DRUM,1531,g to th
631,moccasin lawn cornsilk chartreuse midnight,Manufacturer#2,Brand#22,STANDARD ANODIZED NICKEL,34,WRAP BAG,1532,ely silen
632,blush floral tan thistle chiffon,Manufacturer#3,Brand#34,PROMO PLATED NICKEL,2,MED PACK,1533,y ironic instru
633,navy burnished wheat slate deep,Manufacturer#3,Brand#33,ECONOMY POLISHED NICKEL,24,MED PKG,1534,bold brai
634,grey aquamarine deep violet blush,Manufacturer#3,Brand#35,SMALL ANODIZED NICKEL,34,MED DRUM,1535,ions.
635,ghost aquamarine gainsboro lemon peach,Manufacturer#5,Brand#51,PROMO POLISHED STEEL,49,WRAP JAR,1536,y ironic excuses.
636,burlywood deep antique snow wheat,Manufacturer#5,Brand#55,PROMO BRUSHED STEEL,36,SM PACK,1537,ithely
637,brown smoke sandy honeydew antique,Manufacturer#5,Brand#51,LARGE BURNISHED NICKEL,48,JUMBO CASE,1538,oxes after the blithel
638,lace royal pink cornsilk antique,Manufacturer#5,Brand#54,SMALL PLATED TIN,37,JUMBO PACK,1539," carefully. blithely "
639,black plum tomato cornflower medium,Manufacturer#2,Brand#25,STANDARD POLISHED BRASS,33,SM BAG,1540,s cajole quickly. care
640,grey seashell bisque indian deep,Manufacturer#1,Brand#12,MEDIUM BRUSHED TIN,20,WRAP CASE,1541,ly regular acco
641,mint saddle yellow sienna frosted,Manufacturer#5,Brand#55,MEDIUM PLATED COPPER,18,SM JAR,1542," bold instr"
642,moccasin ghost sandy goldenrod cornsilk,Manufacturer#4,Brand#43,ECONOMY BRUSHED BRASS,12,MED PACK,1543," bold packages bey"
643,frosted chocolate dodger honeydew ghost,Manufacturer#3,Brand#32,MEDIUM POLISHED STEEL,8,MED DRUM,1544,refully fina
644,rosy bisque hot burnished dark,Manufacturer#5,Brand#52,LARGE PLATED STEEL,34,SM PACK,1545,lphins. blithely
645,thistle sky antique khaki chartreuse,Manufacturer#4,Brand#45,MEDIUM BURNISHED NICKEL,45,LG CASE,1546," the theodol"
646,tan honeydew lime light white,Manufacturer#5,Brand#52,SMALL POLISHED COPPER,21,LG PACK,1547,ajole according to t
647,rose khaki drab smoke peach,Manufacturer#3,Brand#35,LARGE BURNISHED STEEL,38,MED PKG,1548,ters. ironic pinto
648,bisque blue drab cyan almond,Manufacturer#3,Brand#34,SMALL BRUSHED STEEL,2,WRAP JAR,1549,eas. regular
649,lavender blush rosy beige sky,Manufacturer#1,Brand#12,STANDARD BURNISHED TIN,33,JUMBO DRUM,1550,fully!
650,bisque navajo mint medium seashell,Manufacturer#5,Brand#53,PROMO ANODIZED NICKEL,40,MED JAR,1551,ar dependen
651,bisque floral dim burlywood moccasin,Manufacturer#5,Brand#52,MEDIUM POLISHED BRASS,4,WRAP BAG,1552,efully final instruct
652,navajo white indian yellow grey,Manufacturer#1,Brand#12,LARGE BRUSHED TIN,39,WRAP PKG,1553,le furiously unusua
653,lime cornflower sky beige antique,Manufacturer#1,Brand#15,ECONOMY BURNISHED BRASS,28,JUMBO DRUM,1554,ias. i
654,cyan burnished tomato chiffon navy,Manufacturer#2,Brand#23,PROMO PLATED COPPER,2,WRAP BAG,1555,posits haggle 
655,tomato firebrick yellow rosy orchid,Manufacturer#1,Brand#12,STANDARD BURNISHED TIN,23,JUMBO CAN,1556,ic instructions.
656,maroon dodger ghost gainsboro pink,Manufacturer#1,Brand#15,STANDARD BURNISHED COPPER,17,MED CASE,1557,tions wake ca
657,saddle lawn blue cyan cornsilk,Manufacturer#3,Brand#31,ECONOMY BURNISHED COPPER,36,LG PACK,1558," packages accord"
658,ghost mint hot bisque salmon,Manufacturer#1,Brand#15,MEDIUM PLATED COPPER,27,SM JAR,1559," somas haggle quickly"
659,black bisque plum pale cyan,Manufacturer#3,Brand#34,MEDIUM BRUSHED BRASS,20,LG JAR,1560,across the 
660,sky dim thistle saddle pale,Manufacturer#5,Brand#51,STANDARD POLISHED TIN,8,SM CAN,1561,ages cajole fluffily 
661,snow beige moccasin red lime,Manufacturer#3,Brand#32,PROMO PLATED STEEL,35,SM PKG,1562,ng asympt
662,ivory chocolate slate midnight ghost,Manufacturer#4,Brand#45,STANDARD PLATED STEEL,35,LG PACK,1563,e eve
663,ivory orchid azure frosted light,Manufacturer#4,Brand#41,PROMO POLISHED COPPER,6,WRAP PACK,1564," beans"
664,frosted burnished tomato chiffon seashell,Manufacturer#4,Brand#43,MEDIUM BURNISHED TIN,26,LG BAG,1565,about the slyly s
665,rose antique cyan cornflower drab,Manufacturer#1,Brand#13,MEDIUM POLISHED STEEL,14,MED DRUM,1566,usly final excuse
666,ivory dim orchid antique spring,Manufacturer#1,Brand#13,ECONOMY BURNISHED NICKEL,20,MED PACK,1567,ronic theodolites ca
667,wheat ghost honeydew plum grey,Manufacturer#4,Brand#43,MEDIUM PLATED STEEL,42,MED JAR,1568,ly pending packages. 
668,honeydew pink dodger cream dim,Manufacturer#2,Brand#22,SMALL ANODIZED NICKEL,10,LG PACK,1569,odolites. furio
669,khaki metallic plum smoke hot,Manufacturer#1,Brand#11,STANDARD BRUSHED TIN,37,MED BAG,1570,bold deposi
670,slate black smoke pale moccasin,Manufacturer#1,Brand#12,ECONOMY PLATED COPPER,24,LG DRUM,1571,es use fluffily unusu
671,powder metallic salmon slate chocolate,Manufacturer#5,Brand#53,SMALL PLATED STEEL,31,JUMBO BOX,1572,es. s
672,lawn rosy cornsilk floral misty,Manufacturer#2,Brand#23,PROMO BURNISHED STEEL,13,LG PACK,1573,", pen"
673,navy azure sandy yellow sky,Manufacturer#2,Brand#23,MEDIUM ANODIZED COPPER,26,SM DRUM,1574,y final 
674,tomato chartreuse cornflower green pale,Manufacturer#3,Brand#35,SMALL BRUSHED TIN,5,LG PKG,1575,unts use slyly bold
675,misty hot pale ghost yellow,Manufacturer#1,Brand#11,LARGE BRUSHED COPPER,2,SM CAN,1576,ely re
676,moccasin cornflower burlywood tomato light,Manufacturer#1,Brand#11,MEDIUM ANODIZED BRASS,45,SM CAN,1577,ges. enticingly ironi
677,pale steel blush mint cream,Manufacturer#4,Brand#44,PROMO ANODIZED BRASS,6,WRAP BAG,1578,accounts 
678,salmon ivory red dodger spring,Manufacturer#4,Brand#44,PROMO BRUSHED TIN,15,SM BAG,1579,ronic pin
